"content","cmp_code","eu_code"
"Wij willen ook vastleggen in de wet dat overheden niet ingrijpen in internetprotocollen.","201.2",NA
"Steeds meer landen willen controle over hun burgers via het internet (via afscherming, blokkades, censuur, surveillance) en over het internet zelf (via netneutraliteit, het beheer en de uitgifte van namen en nummers).","201.2",NA
"Steeds vaker raakt dit de centrale protocollen waarop het internet draait (Internet Protocol, Hypertext Transfer Protocol, etc.).","201.2",NA
"Dit maakt het internet onveiliger en onbetrouwbaarder.","201.2",NA
"Daarom moet Nederland zich inzetten voor een internationale afspraak dat landen de centrale internetprotocollen met rust laten.","201.2",NA
"D66 wil een zogenaamd ‘bug bounty programma’ opzetten – waarbij welwillende hackers beloond worden voor het vinden van beveiligingsproblemen – om de digitale infrastructuur van de overheid zo goed mogelijk te beschermen en hackers stimuleren om fouten die zij vinden in die infrastructuur te melden aan de overheid.","201.2",NA
"Onafhankelijk Nationaal Cyber Security Centrum (NCSC)","H",NA
"Om de cyberveiligheid in Nederland nog beter te dienen, moet het NCSC echt onafhankelijk worden, vergelijkbaar met het Rijksinstituut voor Volksgezondheid en Milieu (RIVM).","104",NA
"Zo kunnen justitie of de Algemene Inlichtingen en Veiligheidsdienst (AIVD) geen invloed uitoefenen op de adviezen.","104",NA
"D66 wil dat het werk van goedwillende hackers meer opvolging krijgt.","104",NA
"Daarom wil D66 dat producenten makkelijker aansprakelijk gesteld kunnen worden voor bekende beveiligingslekken waar geen patches voor beschikbaar zijn.","104",NA
"Gezien de successen met Responsible Disclosure, geeft de overheid het goede voorbeeld.","104",NA
"Vol vertrouwen in de wereld","H",NA
"Ruim 25 jaar na de val van de Berlijnse muur is er van het door sommigen voorspelde ‘einde van de geschiedenis’ weinig meer over.","107",NA
"In plaats van een wereldwijde beweging naar liberale democratie waarnaar met ‘het einde van de geschiedenis’ verwezen wordt, houden anno 2016 veel grote vraagstukken voor Nederland juist direct verband met het buitenland.","107",NA
"Vluchtelingen, klimaatproblematiek, Brexit of verkiezingen of staatsgrepen in landen die ons leven direct raken.","107",NA
"En in een globaliserende wereld neemt de verwevenheid tussen binnen- en buitenland alleen maar toe.","107",NA
"De afgelopen jaren hebben gebeurtenissen in Noord-Afrika, het Midden-Oosten en Oekraïne laten zien dat wij direct geraakt worden door ontwikkelingen over de grens.","107",NA
"Met alle kansen en uitdagingen die daarbij horen.","107",NA
"Er is geen afstandsbediening om die buitenwereld op pauze te zetten;","107",NA
"laat staan terug te spoelen.","107",NA
"We kunnen én willen niet om het buitenland heen.","107",NA
"In de verhouding met Rusland is een nieuwe fase aangebroken met de annexatie van de Krim en het op gang brengen en houden van de afscheidingsbeweging in Oost-Oekraïne.","107",NA
"Voor het eerst sinds de Tweede Wereldoorlog heeft een Europees land met het gebruik van militaire middelen een deel van een ander land bezet en geannexeerd.","107",NA
"Zolang Rusland niet voldoet aan het Minsk vredesakkoord handhaven wij de bestaande sancties.","107",NA
"Buitenlands beleid laat zich vaak lastig in specifieke beleidsvoornemens vatten.","107",NA
"Dat komt door de omvang en de complexiteit van het internationale schaakspel.","107",NA
"We leven in een wereld waarin de toenemende assertiviteit van landen als China en Rusland en de opkomst van bijvoorbeeld India, Nigeria en Indonesië de voor ons zo comfortabele wereldorde van de laatste decennia van de 20e eeuw onder druk zet.","107",NA
"Als klein land met een relatief grote economie en reputatie kan Nederland nog steeds invloed hebben wanneer we samenwerken met andere, gelijkgestemde landen.","107",NA
"Daarin ligt voor ons de uitdaging.","107",NA
"Hoe zorgen we als bescheiden speler voor maximale zeggenschap in een geglobaliseerde wereld?","107",NA
"Hoe borgen we onze vrijheid en welvaart en vergroten we die van anderen om ons heen?","107",NA
"Hoe voorkomen we zwakte, maar werken we ook aan wederzijdse ontwapening?","107",NA
"En hoe benutten we de kansen die een veranderende wereldorde met zich meebrengt?","107",NA
"Want verwar bescheidenheid niet met passiviteit:","107",NA
"D66 is ervan overtuigd dat Nederland een grote internationale bijdrage kan leveren.","107",NA
"Als één van de twintig grootste economieën ter wereld, als leider in kennis en innovatie, als hoeder van rechtsstaat en democratie.","107",NA
"Onder invloed van de voortdurende mondiale turbulentie heeft Nederland in de afgelopen jaren de luiken teveel dichtgetrokken.","107",NA
"De blik naar binnen gericht.","107",NA
"Dat leidt niet alleen tot verenging van het debat en verarming van onze samenleving.","107",NA
"Het zorgt ook voor onnodig veel verlies van invloed.","107",NA
"Dat kan anders en beter.","107",NA
"Dat moet anders en beter.","107",NA
"Want als wij zelf de handschoen niet oppakken, doen anderen dat voor ons.","107",NA
"De geschiedenis is in dat opzicht meedogenloos.","107",NA
"Wij zijn optimistisch, maar niet naïef.","107",NA
"Een wereld in beweging biedt kansen, maar ook serieuze uitdagingen.","107",NA
"Wij willen dat Nederland de blik weer naar buiten richt en de wereld probeert mede vorm te geven.","107",NA
"Gekoppeld aan gerichte investeringen, daar waar Nederland het verschil kan maken.","107",NA
"Investeringen die vrijheid en rechtsstaat versterken:","107",NA
"in onderwijs, in bescherming van natuur, in het verspreiden van kennis over voedselzekerheid, met een volwaardige internationale juridische architectuur en als het nodig is ook door noodhulp en door onze defensie in te zetten.","107",NA
"Een hoorbare en merkbare Nederlandse stem in de wereld vereist dat we alle beschikbare middelen veel beter op elkaar afstemmen en met meer ambitie en vertrouwen inzetten.","108",NA
"Daarom kiezen wij voor een buitenlandbeleid gebaseerd op drie pijlers:","108",NA
"sterke diplomatie, ambitieuze internationale samenwerking en moderne defensie.","108",NA
"Allen ingebed in een sterk Europa.","108",NA
"Want deze blik naar buiten vraagt om meer lef en de bereidheid tot verdergaande Europese samenwerking – of het nou gaat om mensenrechten, handel of veiligheid.","108",NA
"Wij kunnen blijven doen alsof we zelf belangentegenstellingen met landen als Rusland of China in ons voordeel kunnen beslechten.","108",NA
"Of zelf migratie sturen.","108",NA
"Of in ons eentje voor gereguleerde internationale handel zorgen.","108",NA
"Dat is onzin.","108",NA
"Als we vraagstukken over klimaat, terrorisme, vluchtelingen, energie, veiligheid en handel op willen lossen, dan moet dat samen met Europa.","108",NA
"Europa bracht ons duurzame vrede en veiligheid, groei en welvaart.","108",NA
"De onderlinge relaties in Europa brengen verbondenheid, begrip en verdraagzaamheid en bieden daarmee een waarborg voor individuele vrijheid en vrede.","108",NA
"In een wereld waar uitdagingen als veiligheid, energie, verduurzaming en vluchtelingenstromen grenzen overschrijden, is een slagvaardig Europa cruciaal.","108",NA
"Juist voor Nederland.","108",NA
"Geen land is voor zijn veiligheid, zijn politieke gewicht in de wereld en zijn economische welvaart zo afhankelijk van intensieve samenwerking met de landen om zich heen.","108",NA
"Daarom moeten wij vooroplopen in het verbeteren van de Europese Unie.","108",NA
"D66 is ervan overtuigd dat Europa veel beter kan.","108",NA
"Veel beter moet.","108",NA
"Veel beter verdient.","108",NA
"Problemen los je niet op door lijdzaam toe te kijken, maar door daadkrachtig op te treden.","108",NA
"Het referendum over de Brexit en de daaruit voortvloeiende onrust hebben ons gesterkt in onze overtuiging.","108",NA
"Wij kiezen vol voor een Europa dat zich op samenwerking richt en op die gebieden presteert.","108",NA
"Een democratischer, transparanter en slagvaardiger Europa.","108",NA
"Een verenigd en verbeterd Europa geeft de meeste invloed aan onze Nederlandse stem.","108",NA
"Met een duidelijk herkenbaar geluid voor vrijheid en rechtsstaat – in Europa en daarbuiten.","108",NA
"Nederland wordt sterker in een democratisch Europa","H",NA
"Wij kiezen voor een Europa waarin mensen en landen zich aan elkaar verbinden op grensoverschrijdende thema’s en landen tegelijk hun zelfstandigheid en eigen karakter behouden waar dat zinvol en wenselijk is.","108",NA
"Een federaal Europa laat per definitie alle ruimte voor de diversiteit van nationale, regionale en menselijke verschillen en identiteiten.","108",NA
"Bevoegdheden liggen dan ook daar waar zij het best uitgevoerd kunnen worden en de beste waarborg voor persoonlijke vrijheid bieden.","108",NA
"Beslissingen worden het liefst zo dicht mogelijk bij mensen genomen, maar soms zijn problemen te groot om lokaal of nationaal op te lossen.","108",NA
"De Europese Unie moet beter: democratischer, transparanter, slagvaardiger","H",NA
"Wij hebben moeite met de trage, ondoorzichtige en gecompliceerde besluitvorming in Europa.","108",NA
"Het stoort ons hoe politieke strijd in één land de hele Unie lam kan leggen.","108",NA
"Europese leiders gaan te vaak van Eurotop naar Eurotop, zonder dat mensen tastbare resultaten zien.","108",NA
"Dit ligt niet aan Europa, maar aan de lidstaten die over de werking van Europa beslissen.","108",NA
"Dit ligt daarmee ook aan de Nederlandse regering en aan Nederlandse politici.","108",NA
"D66 wil dat besluiten in Europa sneller, transparanter en simpeler genomen worden.","108",NA
"Mensen willen meer zicht en meer grip op wat er in Europa gebeurt.","108",NA
"Vanuit ons democratisch DNA willen wij mensen ook meer te zeggen geven.","108",NA
"Daarom willen we minder veto’s, een steviger mandaat voor het Europees Parlement en de Europese Commissie, Europese kieslijsten bij Europese verkiezingen, een meer democratische Europese senaat ter vervanging van de raad en uiteindelijk een gekozen voorzitter.","108",NA
"Voor deze verbeteringen is verdragswijziging nodig.","108",NA
"Verder na de Brexit","H",NA
"Het Brexit-referendum heeft tot veel onzekerheid geleid.","108",NA
"De schadelijke gevolgen daarvan zijn in het Verenigd Koninkrijk al voelbaar, maar raken inmiddels ook Nederland.","108",NA
"Daarom moet er zo snel mogelijk duidelijkheid komen over de nieuwe relatie tussen de Europese Unie en het Verenigd Koninkrijk.","108",NA
"Daarbij is duidelijk dat vertrek uit de EU consequenties moet en zal hebben voor de Britse invloed op Europees beleid.","108",NA
"D66 zal zich dan ook hevig verzetten tegen eventuele afspraken waarbij het Verenigd Koninkrijk onevenredig veel invloed of voordelen krijgt in verhouding tot haar bijdrage aan de EU.","108",NA
"Tegelijkertijd blijft het Verenigd Koninkrijk een belangrijke partner op terreinen als handel en buitenlandse betrekkingen, zoals de NAVO.","104",NA
"Als Schotland of Noord-Ierland zich afscheiden en bij de Europese Unie willen blijven horen, dan staat D66 welwillend tegenover hun lidmaatschap.","104",NA
"Ook bedrijven en instellingen die een vestigingsplaats in de EU zoeken zullen wij met open armen verwelkomen.","104",NA
"De Brexit-uitslag toont eens te meer aan dat de EU haar meerwaarde en slagkracht duidelijker moet bewijzen.","108",NA
"Vooruitgang boeken op grote kwesties als asiel en migratie, veiligheid en criminaliteit, de verhoudingen met Rusland of de rol van de EU in Syrië, energie, de klimaatcrisis en digitale economie is daarvoor cruciaal.","108",NA
"Dit kan niet zonder ingrijpende hervormingen om Europa slagvaardiger en democratischer.","108",NA
"Indien nodig, moet Nederland daarom samen met een kopgroep van landen intensiever optrekken om te laten zien wat mogelijk is op deze grote kwesties.","108",NA
"Een Nexit, vertrek van Nederland uit de EU, is voor D66 onbespreekbaar.","108",NA
"Wij zullen ook geen medewerking verlenen aan het uitschrijven van een speciaal referendum hierover.","108",NA
"D66 is voorstander van referenda als noodrem op nieuwe wetgeving, maar niet als volksgericht om met één pennenstreek de vooruitgang die zestig jaar Europese samenwerking ons heeft gebracht in vrede, welvaart en veiligheid, vastgelegd in wet- en regelgeving en verdragen, uit te wissen.","202.4",NA
"De huidige referendumwetgeving en het instrument zelf zijn volstrekt ongeschikt voor dergelijke besluiten en dient te worden aangepast zodat stilzwijgende goedkeuring van verdragen die binnen het Koninkrijk alleen voor Nederland of een deel daarvan gelden geen onderwerp van een referendum kunnen zijn.","202.4",NA
"Lid zijn en worden van de EU","H",NA
"De Europese Unie is geen keuzemenu.","108",NA
"Lidstaten mogen delen van de verdragen niet naar behoeve buiten werking stellen.","108",NA
"Nieuwe lidstaten moeten kiezen voor het gehele “Acquis communautaire”.","108",NA
"We moeten tegelijkertijd ook erkennen dat in sommige gevallen een deel van de landen, bijvoorbeeld de landen die de Euro delen, sneller vooruit wil dan de rest.","108",NA
"Om niet gegijzeld te worden door die laatste landen is D66 voorstander van een Europa van twee snelheden waarbij conform Titel IV van het Verdrag van de EU voor een groep lidstaten in de Europese Unie mogelijk moet zijn om nauwer met elkaar samen te werken en andere lidstaten kunnen inspringen zodra die daar klaar voor zijn.","108",NA
"Soms is dit de enige reële kans om politieke problemen binnen de huidige EU op te lossen.","108",NA
"De omarming van het volledige stelsel aan Europese regels en beleid is een voorwaarde voor toetreding tot de Unie.","108",NA
"Voor mogelijke nieuwe leden ligt de lat onverminderd hoog.","108",NA
"Korte termijn overwegingen en geopolitieke verhoudingen mogen niet leiden tot marchanderen met de toetredingscriteria, noch tot het in de kou laten staan landen die toenadering zoeken en noemenswaardige vooruitgang maken.","108",NA
"Als het huidige proces van uitholling van de Turkse rechtsstaat, waaronder de mogelijke herinvoering van de doodstraf, verder gaat, zijn verdere stappen in toetreding ongeloofwaardig en wil D66 de onderhandelingen over toetreding stopzetten.","108",NA
"Voor visumvrij reizen in de Schengenzone, zoals bijvoorbeeld voor Turkije, gelden heldere criteria en afspraken die niet onderhandelbaar zijn ten behoeve van politieke deals.","108",NA
"Ook landen die al lid zijn, moeten zich aan de regels op het gebied van democratie, rechtsstaat en burgerlijke vrijheden houden.","108",NA
"Om dit te bewaken moeten meer waarborgen worden ingebouwd.","108",NA
"Het Europees Parlement heeft het D66-initiatief voor een jaarlijkse grondrechtentoets voor alle lidstaten omarmd, zodat niet alleen gemaakte afspraken over begrotingsdiscipline, maar ook de Europese waarden worden nageleefd.","108",NA
"D66 wil dat de uitkomst van deze toets jaarlijks wordt besproken in de nationale parlementen, onder leiding van een rapporteur democratie, rechtsstatelijkheid en grondrechten.","108",NA
"Europees nabuurschap","H",NA
"D66 vindt het noodzakelijk in de periferie van de EU bij te dragen aan verbetering van de rechtstaat, de strijd tegen corruptie en de ontwikkeling van het maatschappelijk middenveld.","108",NA
"Dat is in het belang van de EU en daarmee van Nederland.","108",NA
"D66 steunt daarom bijvoorbeeld de consequente implementatie van associatieverdragen met landen als Georgië en Moldavië.","108",NA
"De EU dient daarbij een voorspelbare en betrouwbare partner te zijn voor hen die afspraken nakomen en aan criteria voldoen, bijvoorbeeld als het gaat om visumvrij reizen.","108",NA
"Alleen dan kan de EU haar geloofwaardigheid bewaren, een referentiepunt zijn voor ontwikkelende democratieën en een positieve impact hebben op haar buurregio.","108",NA
"Anders begroten, structureel meer geld naar kennis, innovatie en duurzame groei","H",NA
"Europa moet effectiever investeren in economische groei.","506",NA
"Overheidsbegrotingen, ook die van de Europese Unie zelf, moeten daarom fundamenteel anders.","506",NA
"D66 wil af van de starre Europese zevenjaarsbegroting, waarin vooral geld naar landbouwsubsidies en regiofondsen gaat.","506",NA
"Wij willen flexibelere begrotingen gericht op innovatie, duurzame infrastructuur, energie en kennis.","506",NA
"Een echte begroting, gebaseerd op eigen middelen in plaats van het gehakketak om bijdragen van lidstaten.","506",NA
"Nederland moet daarin vol inzetten op een grotere ontvangst vanuit de Europese fondsen – gebaseerd op de beste voorstellen en niet op basis van handjeklap rond verdeelsleutels.","506",NA
"Dat is belangrijk voor onderzoek, innovatie en regionale investeringen in Nederland","506",NA
"Europa is cruciaal voor schone en digitale groei","H",NA
"Europa is essentieel voor ambitieuze schone en digitale groei.","416.2",NA
"In en met Europa zorgen wij voor één digitale markt waarin het echt eenvoudig is over grenzen digitaal zaken te doen.","416.2",NA
"We bouwen aan een energiemarkt die snel kan verduurzamen, maken afspraken met handelspartners waarin we onnodige barrières opheffen, met oog voor mens, natuur en milieu en maken Nederland en Europa tot een plek waar talent zich maximaal ontwikkelt en waar internationaal talent zich graag vestigt.","416.2",NA
"Onze stem in de wereld","H",NA
"Een sterk Europa kan ook in de 21e eeuw een vuist maken tussen machtsblokken als de Verenigde Staten, Rusland en China.","108",NA
"Europese landen staan voor een keuze:","108",NA
"laten we ons uiteen spelen of gaan we gezamenlijk de uitdagingen van de 21e eeuw aan?","108",NA
"Hierbij geldt:","108",NA
"verscheidenheid is prachtig, verdeeldheid is funest.","108",NA
"Daarom kiest D66 voor stevige Europese samenwerking, breed gedragen door 450 miljoen Europeanen.","108",NA
"Voor een gezamenlijk buitenlands- en veiligheidsbeleid, vertegenwoordigd door een Eurocommissaris met een netwerk van EU-ambassades.","108",NA
"Voor het bundelen van de krachten bij ontwikkelingssamenwerking met minder bureaucratie.","108",NA
"Voor één EU-vertegenwoordiging in de Veiligheidsraad, Wereldhandelsorganisatie en Wereldbank.","108",NA
"Als één blok staan en strijden we voor de bescherming van onze belangen en voor de rechten en vrijheden van mensen.","108",NA
"D66 wil dat Nederlandse diplomaten de ontwikkeling van een gemeenschappelijk Europees buitenlands beleid aanjagen.","108",NA
"Samenhangend internationaal beleid","H",NA
"Nederland en Europa zullen voortdurend onze plaats in de wereld en onze positie in de vele internationale vraagstukken moeten bepalen.","108",NA
"Er is en blijft behoefte aan behartiging van de economische belangen van Nederland in het buitenland.","108",NA
"Daarbij heeft Nederland een verantwoordelijkheid voor de meer dan een miljoen Nederlanders in het buitenland.","108",NA
"Binnen de contouren van een gemeenschappelijk Europees buitenlands beleid willen we een actieve diplomatie en een overheid die zich sterk richt op het buitenland.","108",NA
"Het kiezen voor rechtsorde, veiligheid, mensenrechten en democratie vormt een startpunt.","108",NA
"Met deze leidraad zal Nederland een actieve rol moeten vervullen in complexe internationale situaties in de instabiele ring rond Europa, in Afrika en in het Midden-Oosten.","108",NA
"Onze positie als land van vrede en recht gaat gepaard met de verplichting deze waarden vol overtuiging uit te dragen.","108",NA
"Nederland maakt, in navolging van Scandinavische landen, duidelijke keuzes:","108",NA
"we kunnen niet alles doen en moeten ons inzetten op die terreinen waar Nederland een toegevoegde waarde heeft.","108",NA
"Actieve diplomatie","H",NA
"Nederland kan zijn stem voor democratie en rechtsstaat niet laten horen, maatschappelijke organisaties ondersteunen, onze ondernemers faciliteren of Nederlanders in buitenland helpen zonder de juiste middelen.","108",NA
"Daarom investeren we in een diplomatieke dienst, die meer dan voorheen is gericht op aanwezigheid in het buitenland:","108",NA
"een sterk netwerk van Nederlandse ambassades, adequate vertegenwoordiging bij internationale organisaties en voldoende capaciteit voor tijdelijke internationale missies.","108",NA
"In Europees verband bepleiten we een volwaardige Europese Minister van Buitenlandse Zaken:","108",NA
"een zwaargewicht met actieve politieke agenda.","108",NA
"Deze minister wordt ondersteund door een volwaardige Europese diplomatieke dienst die niet slechts dient als 29e ambassade, maar een coördinerende rol speelt en de krachten van lidstaten kan bundelen.","108",NA
"Zo lang de EU niet een eigen minister en volwaardige buitenlandse dienst heeft, doet Nederland haar uiterste best om bij de VN en haar deelorganisaties een adequate Nederlandse vertegenwoordiging te hebben, met als doel dubbel werk, disfunctionele beleids- en besluitvorming en verspilling tegen te gaan.","108",NA
"Aandacht voor Nederlanders in het buitenland","H",NA
"Er wonen ongeveer een miljoen Nederlanders tijdelijk of permanent over de grens.","303",NA
"D66 wil dat er structurele aandacht is voor hun belangen en hun betrokkenheid bij Nederland.","303",NA
"Dat begint met snelle en toegankelijke dienstverlening door posten in het buitenland en online, waarmee we bijvoorbeeld de mogelijkheid bieden om in het buitenland een paspoort of DigiD aan te vragen.","303",NA
"Maar ook met de actieve inzet om deze Nederlanders deel te laten nemen aan verkiezingen waarvoor zij stemgerechtigd zijn.","303",NA
"Hierbij kijken we actief naar het vereenvoudigen van de huidige procedure, en houden we technologische ontwikkelingen nauwlettend in de gaten.","303",NA
"We hebben ook nadrukkelijk aandacht voor onze grensprovincies en het oplossen van problemen waar zij tegenaan lopen met de buurlanden.","303",NA
"Meervoudige nationaliteit","H",NA
"Wij zijn er trots op dat mensen van verschillende afkomst Nederlander zijn.","607.1",NA
"Niemand hoeft in Nederland zijn oorspronkelijke nationaliteit op te geven.","607.1",NA
"Ook Nederlanders in het buitenland houden hun Nederlanderschap zolang zij dat willen.","607.1",NA
"Voor oud-Nederlanders die in de afgelopen decennia onvrijwillig hun Nederlanderschap hebben verloren, wordt een speciaal loket ingericht om hen eenmalig de kans te geven het Nederlanderschap terug te krijgen, zonder verlies van hun andere nationaliteit.","607.1",NA
"Kiezen voor rechtsorde, veiligheid, mensenrechten en democratie","H",NA
"D66 streeft naar een vrije en rechtvaardige wereld.","201.2",NA
"Dat betekent dat we streven naar een wereld waarin de progressieve liberale waarden centraal staan.","201.2",NA
"Zonder een goed functionerende rechtsstaat en democratie bestaat vrijheid namelijk niet.","201.2",NA
"Voor individuen betekent dit dat we mensenrechten, zoals de vrijheid van meningsuiting en gelijke rechten tussen mannen en vrouwen, vooropstellen.","201.2",NA
"D66 komt op voor persvrijheid in landen waar deze in toenemende mate onder druk staat.","201.2",NA
"Iedereen, waar ook ter wereld, heeft het recht en de vrijheid zichzelf te zijn.","201.2",NA
"We vergroten daartoe de uitgaven voor het Nederlands mensenrechtenfonds.","201.2",NA
"Wereldwijd moet er aandacht zijn voor de emancipatie van vrouwen en meisjes, etnische en religieuze minderheden en LHBTI’ers.","201.2",NA
"Voor staten betekent dit dat het internationaal recht het uitgangspunt is.","107",NA
"Een goede internationale rechtsorde en veiligheid wereldwijd zijn niet alleen in ons eigen belang, maar vormen de basis voor vrede, vrijheid en welvaart die wij aan alle mensen gunnen.","107",NA
"De beste manier om een wereld te bereiken waarin iedereen in vrede, vrijheid en veiligheid kan leven, is door internationale samenwerking.","107",NA
"Aantasting van beginselen van democratische rechtsstaat moet gevolgen hebben voor onze internationale relaties.","107",NA
"De internationale veiligheidssituatie is de laatste jaren sterk verslechterd.","104",NA
"De EU-landen zijn omringd door een ring van instabiliteit die van Rusland via het Midden-Oosten naar Noord-Afrika leidt.","104",NA
"Het Nederlandse veiligheidsbeleid dient zich allereerst op de crises in die gebieden te richten.","104",NA
"Daarnaast wil D66 dat Europa haar afhankelijkheid van fossiele brandstoffen, die we veelal importeren uit landen met instabiele en autocratische regimes zoals Rusland en Saoedi-Arabië, versneld afbouwt.","416.2",NA
"D66 kiest ervoor dit in Europees verband te doen.","416.2",NA
"Mensenrechten mogen niet ondergeschikt worden gemaakt aan handel.","416.2",NA
"Samenwerken met dictators en autocratische regimes zal op de lange termijn leiden tot minder stabiliteit.","416.2",NA
"Het is belangrijk dat bij economische missies ook de mensenrechten worden besproken.","416.2",NA
"Het bevorderen van de mensenrechten wereldwijd is alleen geloofwaardig als Nederland zelf volledige verantwoording aflegt over het eigen verleden.","107",NA
"Daarom wil D66 dat er een onderzoek komt naar het geweld, van beide zijden, tijdens de Indonesische onafhankelijkheidsoorlog.","104",NA
"Israël-Palestina","H",NA
"D66 steunt een twee-statenoplossing voor het Israëlische-Palestijnse conflict, op basis van de grenzen van 1967.","107",NA
"Om de haalbaarheid van die oplossing te beschermen, moet Nederland de staat Palestina erkennen, maatregelen nemen tegen het Israëlische nederzettingenbeleid en de samenwerking met beide partijen aan voorwaarden onderwerpen.","107",NA
"In het Midden-Oosten vredesproces dient de EU assertiviteit en leiderschap te tonen.","107",NA
"Wanneer de partijen vasthouden aan illegaal beleid dat vrede blokkeert, dan moet de EU daartegen optreden, bijvoorbeeld door opschorting van samenwerkingsovereenkomsten.","107",NA
"D66 veroordeelt alle geweld tegen burgers, steunt mensenrechtenverdedigers en streeft naar vrede en veiligheid voor Israël en Palestina.","107",NA
"Een duurzame oplossing van het Israëlische-Palestijnse conflict is ook vanuit regionaal perspectief dringend geboden.","107",NA
