"content","cmp_code","eu_code"
"D66 wil dat vervuilers betalen, dat schoon en gezonder loont en dat de overheid barrières wegneemt voor nieuwe schone oplossingen en voordelen voor oude vieze oplossingen afbouwt.","416.2",NA
"Dat deden we in het Herfstakkoord 2013 door een heffing in te voeren op kunstmest en op het storten of verbranden van herbruikbare grondstoffen.","416.2",NA
"Nu willen we regelgeving die cleantech en het duurzaam gebruik van energie en grondstoffen in de weg staat, afbouwen.","416.2",NA
"We handhaven de groene heffingskorting en vergroten mogelijkheden voor belastingaftrek voor investeringen in energiebesparing en milieu, zoals de zogenaamde EIAVAMIL-regelingen.","416.2",NA
"In navolging van het energieakkoord wil D66 een grondstoffenakkoord met de sector om belemmeringen voor de circulaire economie weg te nemen, ruimte te maken voor (grootschalige) demonstratieprojecten en internationale samenwerking te bevorderen.","416.2",NA
"We bouwen voort op het reeds gerealiseerde D66-idee van de Noordzee Grondstoffenrotonde en zorgen dat de markt voor duurzame grondstoffen van de grond komt in het Schengengebied door eenvoudiger grensoverschrijdend vervoer.","416.2",NA
"Wij zien grote kansen in een op hergebruik gebaseerde, circulaire economie.","416.2",NA
"Veel ondernemers weten nog niet hoe ze aan een circulaire economie kunnen meedoen en de voordelen kunnen benutten.","416.2",NA
"Dus zetten we middelen in op actieve kennisoverdracht.","416.2",NA
"Een verandering van de bedrijfsvoering naar een circulair model vraagt ook investeringen.","416.2",NA
"Vooral voor het MBK gaan we hier een regeling voor treffen.","704",NA
"Onze kennis van logistiek, voedsel en chemie en onze maakindustrie, ligging en infrastructuur geven ons een uitstekende startpositie.","416.2",NA
"Wij bieden ruimte voor experimenten en samenwerking binnen ketens en tussen bedrijven.","416.2",NA
"Met gerichte maatregelen treden we op tegen verspilling van grondstoffen.","416.2",NA
"We investeren in innovatie om de plasticsoep in oceanen aan te pakken, maar ook in het terugdringen van restafval of verspilling van voedsel.","416.2",NA
"Door regels voor voedseldonatie te versoepelen, hoeft er minder voedsel weggegooid te worden.","501",NA
"D66 wil zwerfafval effectief aanpakken.","501",NA
"Daarvoor is uitbreiding van het statiegeldsysteem een optie.","501",NA
"Afval bestaat (bijna) niet","H",NA
"Afval wordt steeds meer gezien en gebruikt als een grondstof en levert nu al een belangrijke bijdrage aan de circulaire economie.","416.2",NA
"Dit kan nog veel beter.","416.2",NA
"Voor D66 is het uitgangspunt dat afval grondstof is en wordt hergebruikt.","416.2",NA
"Iedere producent is verantwoordelijk voor het afval van zijn eigen producten.","416.2",NA
"Dat geldt ook voor zaken als zonnepanelen, accu’s, batterijen en windmolens.","416.2",NA
"Partijen die niet serieus werk maken van hergebruik moeten voor de maatschappelijke kosten opdraaien.","416.2",NA
"Dit kan een producent zijn die zijn verpakking niet geschikt maakt voor scheiden en hergebruiken, maar ook een consument die zijn afval niet scheidt.","416.2",NA
"Bovendien moeten innovaties waarin secundaire grondstoffen worden gebruikt worden gestimuleerd, omdat dit ervoor kan zorgen dat afval ook een positieve economische waarde krijgt en de cirkel echt wordt gesloten.","416.2",NA
"Ook het stimuleren van leasen en delen van producten in plaats van bezitten kan veel afval voorkomen.","416.2",NA
"Overheid koopt duurzaam in","H",NA
"De Nederlandse overheden kopen jaarlijks voor € 60 miljard aan goederen en diensten in.","416.2",NA
"Daarmee kan de overheid een schone economie een enorme zet in de rug geven.","416.2",NA
"Op die manier neemt de overheid verantwoordelijkheid voor het eigen handelen.","416.2",NA
"Door bijvoorbeeld via inkoop de infrastructurele sector te vergroenen kan de overheid een impuls geven aan innovaties die ook in andere sectoren, zoals de bouw, toepasbaar zijn.","416.2",NA
"Te vaak is duurzaam inkopen bij woorden gebleven en dit kabinet laat veel te weinig daadkracht zien.","416.2",NA
"D66 wil de komende kabinetsperiode met gemeenten, provincies en waterschappen bereiken dat 100% van alle overheidsinkopen 100% duurzaam zijn, zonder dat we criteria afzwakken.","416.2",NA
"Het leveren van maatschappelijke meerwaarde wordt gestimuleerd en beloond.","416.2",NA
"Mede op deze manier neemt de overheid haar verantwoordelijkheid door haar inkoopkracht als stuurmiddel in te zetten om duurzame ontwikkelingen aan te jagen.","416.2",NA
"Fiscale vergroening","H",NA
"De manier waarop wij belasting heffen, heeft grote gevolgen voor de relatieve prijzen van vuil en schoon gedrag.","416.2",NA
"Te vaak bevorderen belastingregels het gedrag dat we juist niet willen.","416.2",NA
"De afgelopen jaren heeft D66 gezorgd voor fiscale vergroening, bijvoorbeeld door belastingvrijstellingen op vervuilende zaken als rode diesel te schrappen en schone activiteiten minder te belasten, zoals lagere energiebelasting op elektrische auto’s.","416.2",NA
"D66 zal deze lijn voortzetten.","416.2",NA
"Binnen de te heffen belastingen willen wij werk en schone activiteiten bevorderen en vervuiling zwaarder belasten.","416.2",NA
"Vervuilen is economisch onverstandig, maar bovenal ongezond","H",NA
"Het opruimen van vervuiling uit water, lucht of bodem is eigenlijk altijd duurder dan het voorkomen van die vervuiling.","416.2",NA
"Vaak zijn de negatieve gevolgen voor gezondheid ook vele malen duurder dan het voorkomen van vervuiling.","416.2",NA
"D66 wil dat de vervuiler betaalt en via strikte normen en handhaving wordt gedwongen vervuiling te voorkomen.","416.2",NA
"Daarbij streven wij naar strenge (Europese) kwaliteitseisen voor lucht, water en bodem, die wij ook strikt zullen handhaven.","416.2",NA
"De positieve gevolgen voor bijvoorbeeld de luchtkwaliteit in onze wijken zullen groot zijn.","416.2",NA
"Met alle gezondheidswinst van dien.","416.2",NA
"De verantwoordelijkheidsverdeling voor grondwater tussen waterschap, provincie en gemeenten wordt vastgelegd, zodat sneller gehandeld kan worden.","416.2",NA
"Gezondheid centraal in het milieubeleid","H",NA
"Schone lucht lijkt een vanzelfsprekendheid, maar één miljoen mensen in Nederland hebben longklachten en ook voor gezonde mensen leidt vieze lucht tot een kortere levensverwachting.","501",NA
"De lucht in de steden en rondom de intensieve veehouderij is nog steeds te vies.","501",NA
"Daarom wil D66 blijven werken aan schone lucht.","501",NA
"Gemeenten moeten meer mogelijkheden krijgen om de gezondheid van hun inwoners te beschermen.","501",NA
"D66 stelt gemeenten in staat om te zorgen voor schone lucht voor hun inwoners, door bijvoorbeeld heel vuile auto’s en vrachtwagens te weren,  autodelen te stimuleren, inwoners mee te laten praten over de maximum snelheid op ringwegen en schone auto’s korting te geven op parkeren.","501",NA
"D66 wil dat in 2025 al het openbaar vervoer rijdt op groene stroom of waterstof.","501",NA
"Het aangekondigde investeringsfonds om de overgang te faciliteren kan worden ondergebracht in de publieke investeringsbank.","501",NA
"Voor de aankoop van nieuwe voertuigen in de (semi-)publieke sector geldt vanaf 2020 ‘elektrisch tenzij’.","501",NA
"Mensen  in Rotterdam, Den Haag, Utrecht of Amsterdam ademen een hoeveelheid vuile lucht in, die gelijk staat aan ruim 6 sigaretten meeroken per dag, elke dag.","501",NA
"Daarom wil  D66 een verlenging tot 2021 van een aangescherpt en gehandhaafd Nationaal Samenwerkingsprogramma Luchtkwaliteit gebaseerd op de normen die de Wereld Gezondheid Organisatie hanteert voor schone lucht.","501",NA
"In dat programma krijgen roet en fijnstof bijzondere aandacht vanwege de lokale gezondheidseffecten.","501",NA
"D66 wil goede Europese maatregelen om sjoemeldiesels uit te bannen.","501",NA
"Welvaart anders meten","H",NA
"Wij kunnen aan de wereld laten zien hoe welvaart en welzijn samen kunnen gaan met het leven binnen het eerlijke deel van onze menselijke voetafdruk op deze aarde.","416.2",NA
"D66 wil daarom dat wij niet alleen ons nationaal product meten en regelmatig met elkaar bespreken als maatstaf van succes, maar dat we breder kijken naar welvaart en welzijn.","416.2",NA
"Onze (ecologische) voetafdruk op de aarde moeten we daarbij net zo transparant maken en onderwerp van discussie laten zijn als onze toegevoegde financiële waarde.","416.2",NA
"Ook steunt D66 de initiatieven om de CBS-Monitor Duurzaam Nederland door te ontwikkelen tot een Monitor Brede Welvaart.","416.2",NA
"Natuur en ruimte zijn van grote waarde","H",NA
"Onze voorstellen rond energie en grondstoffen gaan sterk over economische kansen en rationele keuzes.","501",NA
"Voor ons zijn natuur en ruimte meer dan alleen gebruiksmiddelen voor ons onmiddellijke nut.","501",NA
"Onze verbondenheid met de natuur is veel groter.","501",NA
"D66 wil dat natuur beschermd wordt, omdat wij de wereld beter door willen geven aan onze kinderen dan wij haar aantroffen.","501",NA
"Onze kinderen moeten ook de kans krijgen te genieten van bossen, zeeën en de veelheid aan diersoorten.","501",NA
"Paradoxaal genoeg kan de natuur heel goed zonder de mens, maar de mens niet zonder de natuur.","501",NA
"Zonder bestuivers als hommels en bijen is landbouw onmogelijk.","501",NA
"De eigen waarde van natuur is groot genoeg om ons maximaal in te spannen voor het behoud.","501",NA
"Maar daar bovenop komt nog de ongekende economische waarde van de natuur.","501",NA
"De ecosystemen waar wij in leven bieden ons cruciale diensten als schoon water, schone lucht, hout, bestuiving, natuurlijke kustbescherming, CO2-opvang en het tegengaan van verwoestijning.","501",NA
"Deze functies zijn niet alleen onmisbaar, maar leiden heel vaak ook tot bedrijvigheid.","501",NA
"In Noord-Brabant komt perfect gezuiverd water vanuit de Ardennen in de grond omhoog.","501",NA
"Veel bedrijven die schoon water nodig hebben, zijn daarom daar gevestigd.","501",NA
"De duinen vormen een perfecte kustbescherming en waterzuivering.","501",NA
"Beide diensten zouden onbetaalbaar zijn als we de natuur die hiervoor zorgt zouden verwaarlozen.","501",NA
"Wereldwijd wordt het economisch verlies door de achteruitgang van biodiversiteit jaarlijks geschat op 3% van het bruto nationaal product.","501",NA
"Met de economische groei van de laatste jaren van nog geen 1% is dat iets om over na te denken.","501",NA
"Natuur en ruimte beschermen en herstellen","H",NA
"Van de oorspronkelijke biodiversiteit in Nederland is nog maar 15% over.","501",NA
"D66 gaat uit van de intrinsieke waarde van soorten.","501",NA
"Natuur heeft voor de mens bovendien een toegevoegde waarde omdat zij veel ecosysteemdiensten biedt en wij van haar kunnen genieten.","501",NA
"Daarom wil D66 dat het nieuwe kabinet ambitieuze doelen stelt voor biodiversiteitsherstel, met als inzet een","501",NA
"verdubbeling (30%), en investeert in natuur om de trend te keren en ervoor te zorgen dat onze rijkdom aan soorten planten en dieren weer toeneemt.","501",NA
"Juist door te investeren wordt natuur weerbaar, kunnen we er van genieten en is het ook makkelijker om bezoekers en ondernemers de ruimte te geven.","501",NA
"Herstel van biodiversiteit vraagt om het beschermen van de meest bijzondere natuur in beschermde gebieden op land en zee.","501",NA
"Maar zeker ook om maatregelen die soorten en diversiteit beschermen in landbouwgebieden en bewoonde omgeving.","501",NA
"Dit wil D66 realiseren door meer geld vrij te maken voor dit doel, waarmee we bijvoorbeeld mensen die geld investeren in grond en beheer van natuur- en landschapsschoon fiscaal belonen.","501",NA
"Twee derde van ons landoppervlak heeft een agrarische bestemming en is zeer arm aan soorten.","501",NA
"D66 wil ook de diversiteit van dit cultuurlandschap herstellen.","501",NA
"In Europa hebben we afgesproken, dat ieder land de meest bijzondere natuur goed beschermt.","501",NA
"Nederland moet meer zijn best doen om de Vogelrichtlijn en Habitat richtlijn uit te voeren.","501",NA
"Binnen Nederland blijft het Nationaal Natuur Netwerk met de Natura2000 gebieden voor ons de basis.","501",NA
"Deze samenhangende natuur willen we afmaken, verbinden en beschermen.","501",NA
"Dat de provincies verantwoordelijk zijn voor het uitvoeren van het beleid, maakt niet dat het Rijk op zijn handen kan blijven zitten.","501",NA
"D66 investeert in het versterken van Nationale Parken als parels van onze natuur, inclusief de Markerwadden.","501",NA
"Kwetsbare gebieden worden vrijgemaakt of -gehouden van beschadigende activiteiten, zoals schelpenvisserij of gasboringen.","501",NA
"De Waddenzee, zeearmen en kwetsbare duinen krijgen daarbij bijzondere aandacht.","501",NA
"Voor aantasting van de natuur of de biodiversiteit, zoals bijvoorbeeld voor de aanleg van een weg, moeten maatschappelijke kosten en baten worden afgewogen.","501",NA
"Daarom wil D66 een ecologische toets als uitbreiding van de MKBA.","501",NA
"We sluiten hiermee aan bij het 'zero net loss'-principe dat wij in heel Europa willen hanteren, waarmee aantasting van natuur altijd wordt gecompenseerd.","501",NA
"Het beschermen van het Waddengebied vraagt eenduidig en beter natuurbeheer.","501",NA
"Rust, ruimte, natuur en vrije toegankelijkheid van het strand worden als waardevolle kenmerken van de Nederlandse kustzone (strand, duinen en het nabije achterland) beter beschermd en versterkt.","501",NA
"D66 wil geen versoepeling van bebouwingsvoorschriften in het kustfirmament (strand, dijk en duin).","501",NA
"Dit betekent concreet dat er geen uitbreiding komt van het aantal bestaande slaaphuisjes op het strand.","501",NA
"Voor bescherming en versterking van de Nederlandse kustzone wordt op nationaal niveau een integrale kustvisie ontwikkeld en wordt bestaande regelgeving zo nodig aangescherpt en daarna ook gehandhaafd.","501",NA
"In afwachting van die kustvisie wil D66 dat er geen nieuwe mogelijkheden worden gecreëerd voor het bouwen van recreatiewoningen en appartementen aan de kust.","501",NA
"Naast de natuur in Nederland en het overige Koninkrijk investeren wij ook in natuurbescherming en -herstel in kwetsbare delen van de wereld.","501",NA
"Ruimte voor water","H",NA
"Vooruitlopend op de effecten van klimaatverandering kiezen wij voor rivieren die de ruimte krijgen.","501",NA
"Zo wordt Nederland niet alleen beter tegen eventuele overstromingen beschermd, maar worden rivieren ook ecologisch sterker.","501",NA
"D66 wil dat, mits dat veilig gebeurt, het veen in Nederland weer nat wordt, zodat veen geen CO2 meer uitstoot.","501",NA
"De inzet van het Deltafonds moet zoveel mogelijk met aandacht voor behoud, herstel en ook creatie van natuur zorgen.","501",NA
"Hiervoor komen ook middelen beschikbaar.","501",NA
"De budgetten in het Deltaprogramma en Deltafonds worden gecombineerd.","501",NA
"Naast behoud, herstel en creatie van natuur investeren we, samen met buurlanden, in de kwaliteit van water.","501",NA
"Als we goedkoper en efficiënter over de grens maatregelen kunnen nemen om wateroverlast bij extreem weer te voorkomen, dan behoren die ook tot de mogelijkheden.","501",NA
"In Nederland willen we een doelmatige waterketen waarin de vervuiler betaalt en iedereen betaalt per liter water die gebruikt wordt.","501",NA
"Klimaatverandering leidt ook tot grote wateroverlast door steeds heftiger regenbuien, en tot gezondheidsrisico’s door hittestress in de steden.","501",NA
"D66 wil daarom de klimaat-adaptieve stad stimuleren, door maatregelen om wateroverlast – en daarmee economische en gezondheidsschade – te beperken.","501",NA
"Beschermen oceanen","H",NA
"Enigszins aan ons oog onttrokken, bevatten de oceanen het grootste deel van de natuur op onze planeet.","501",NA
"Honderden miljoenen mensen zijn van deze natuur afhankelijk voor hun voedsel en inkomen.","501",NA
"De oceanen staan onder druk door overexploitatie, vervuiling en verzuring en de plasticsoep.","501",NA
"Nederland heeft zich met veel andere landen verplicht tot het vestigen en actief beheren van beschermde gebieden op de wereldzeeën.","501",NA
"Wij beginnen hiermee in de Noordzee met een netwerk van gebieden als de Doggersbank het Friese Front en de Klaverbank.","501",NA
"Met Europa doen we hetzelfde met de Middellandse Zee, de Atlantische Oceaan, de Arctische kraamkamers en met landen waar wij hulp bieden of mee samenwerken.","501",NA
"Nederland investeert ook in het ontwikkelen van een helder overzicht van de ecologisch en economisch optimale plekken voor al die wereldwijde beschermde gebieden – een onderwerp waar Nederlandse wetenschappers nu al in vooroplopen.","501",NA
"Landbouw, voedsel, dierenwelzijn en biodiversiteit","H",NA
"De Nederlandse landbouw is zeer innovatief, productief en koploper in de wereld.","703.1",NA
"Dat is een economische kracht, het bevordert onze welvaart, maar zorgt ook voor schade aan natuur, landschap, bodem en volksgezondheid.","703.1",NA
"In Nederland moeten we de negatieve effecten verminderen, door minder vlees te produceren, door stallen te bouwen die dierenwelzijn verbeteren en uitstoot van vervuilende stoffen als methaan en fijnstof beperken en door het landbouwgif dat schadelijk is voor bijen te weren.","703.1",NA
"D66 wil natuurinclusieve landbouw:","703.1",NA
"landbouw die in balans is met natuur en biodiversiteit.","703.1",NA
"We helpen boeren die willen overstappen naar biologische bedrijfsvoering en stimuleren innovatie, ook in de keten.","703.1",NA
"Wij werken samen met boeren aan wereldwijde doelen om ontbossing door en voor landbouw te stoppen, de landbouwbijdrage aan klimaatverandering te halveren en beslag op water, bodem en grondstoffen duurzaam te maken met veel meer hergebruik.","703.1",NA
"Met de sector maken we afspraken over het terugdringen van import van soja als","703.1",NA
"veevoer en het maken van kunstmest uit nieuwgewonnen fossiele grondstoffen.","703.1",NA
"Duurzame veeteelt is grondgebonden en cyclisch.","703.1",NA
"Veevoer wordt zoveel mogelijk lokaal geproduceerd en biociden, antibiotica en kunstmest worden weinig of niet gebruikt.","703.1",NA
"Veetransport over grotere afstanden wordt aan banden gelegd.","703.1",NA
"Onze kennis moet bijdragen aan gezonde en duurzame productie in andere regio's van de wereld, waar we via internationale samenwerking in investeren.","703.1",NA
"Met boeren en supermarkten dringen we voedselverspilling verder terug, bijvoorbeeld door afspraken te maken over kleinere verpakkingen.","703.1",NA
"We stimuleren het opschalen van de productie van vleesvervangers.","703.1",NA
"D66 wil de vleesconsumptie en –productie verlagen.","703.1",NA
"Op grote schaal vlees produceren is geen duurzaam verdienmodel voor Nederland, en de overgang naar plantaardige eiwitten biedt ondernemers nieuwe kansen.","703.1",NA
"D66 wil ook meer aandacht voor goed bodembeheer;","703.1",NA
"we streven naar bemestingsevenwicht en gaan bodemverdichting en verlies aan organische stof tegen.","703.1",NA
"D66 pleit voor meer aandacht voor ecologisch onderwijs in het reguliere onderwijs en vooral op agrarische opleidingen.","703.1",NA
"D66 wil, door betere uitwisseling tussen design, agrokennis en praktijkervaring, een fundamentele structuurverandering in de Nederlandse landbouwsector realiseren.","703.1",NA
"D66 wil belemmerende wet- en regelgeving wegnemen.","703.1",NA
"Dat vraagt om een grondige herziening van het EU-landbouwbeleid, het gelijkmatig afbouwen van subsidies en het stimuleren van innovatie en duurzame landbouw.","703.1",NA
"Op die manier maken we de Nederlandse en Europese landbouw wereldwijd toonaangevend.","703.1",NA
"Dieren draaien niet op voor onze groei","H",NA
"In Nederland en in Europa worden dieren de laatste jaren gelukkig beter beschermd, mede dankzij D66.","501",NA
"Die hoge normen voor dierenwelzijn worden geborgd in handelsverdragen, handelsmissies en regels voor maatschappelijk verantwoord ondernemen.","501",NA
"In de komende jaren wil D66 dat in Nederland en in Europa verdere stappen worden gezet om dierproeven in sterke mate verder terug te dringen, onverdoofd slachten zoveel mogelijk te beperken – waarbij ook voor vissen oplossingen gevonden moeten worden – en om ervoor te zorgen dat bij het fokken van dieren het welzijn en niet hoge productie of uiterlijke raskenmerken voorop staan.","501",NA
"Zorgen voor dieren in de veeteelt","H",NA
"Een goede boer zorgt goed voor zijn dieren.","703.1",NA
"We zien echter nog steeds gebruiken in de veeteelt die ten koste gaan van het welzijn van dieren.","703.1",NA
"D66 wil dat de goede zorg voor dieren verder wordt versterkt.","703.1",NA
"Dat vraagt om veetransporten die korter en comfortabeler worden.","703.1",NA
"En om het stoppen van het doden van slachtvarkens en ganzen met CO2 en met de inzet van CO2-vergassing bij het ruimen van pluimvee.","703.1",NA
"D66 is voorstander van een gedeeltelijke vervanging van dierlijke eiwitten in voedsel door plantaardige alternatieven, omdat dit beter is voor dieren, voor de planeet en voor de consument.","703.1",NA
"Met de voedingssector en supermarkten werken we samen aan minder kiloknallers, meer verantwoord vlees, meer en betere plantaardige voeding en succesvollere promotie hiervan.","703.1",NA
"Nederland weert, zoveel mogelijk in Europees verband, textielproducten waarvoor dieren zijn mishandeld, zoals bepaalde soorten wol, bont, dons en exotisch leer.","703.1",NA
"Tegengaan verrommeling van de ruimte","H",NA
"De nationale Omgevingsvisie moet  de weidsheid en openheid van onze ruimte bewaken en verrommeling tegengaan, met een omslag naar een duurzaam en gezond ingericht land.","501",NA
"Waarbij er fysieke ruimte is voor hernieuwbare energievoorziening is groot.","501",NA
"Lokale en regionale overheden krijgen ruimte voor een ambitieus natuur- en milieubeleid en om te kunnen sturen op gezondheid en landschappelijke kwaliteit.","501",NA
"Verdichting van de steden is hierbij van belang om natuur en landschap te ontzien en gelijktijdig de kracht en vitaliteit van steden te vergroten.","501",NA
"Mogelijkheden voor intensivering en hergebruik van gebouwen en terreinen in de stad  wil D66 hiervoor ten volle benutten.","501",NA
"De betrokkenheid van mensen bij keuzes in hun omgeving moet worden gemaximaliseerd door participatie.","501",NA
"Optreden tegen milieucriminaliteit","H",NA
"In Nederland en daarbuiten bestaat uitgebreide wetgeving ter bescherming van milieu en natuur.","605.1",NA
"Te vaak schiet handhaving tekort of zijn straffen onvoldoende afschrikwekkend.","605.1",NA
"Wereldwijd gaat in milieucriminaliteit bijna net zoveel geld om als in mensensmokkel of drugshandel.","605.1",NA
"D66 wil dat veelplegers van milieudelicten en -overtredingen in Nederland extra aangepakt worden via een strafpunten systeem.","605.1",NA
"Daarnaast moet Nederland haar rol spelen in het bestrijden van internationale milieucriminaliteit zoals stroperij (wildlife crime) en het illegaal dumpen van afval.","605.1",NA
"Dat begint met het opsporen van activiteiten die plaatsvinden in Nederland en door Nederlanders en Nederlandse bedrijven en overgaan tot vervolging van overtreders.","605.1",NA
"Maar ook door het steunen van internationale acties, bijvoorbeeld in Europees verband, of door gerichte investering in projecten om vraag te stoppen en overtreders te vervolgen.","605.1",NA
"De Europese Unie moet lessen trekken uit milieuschandalen, zoals het gebruik van sjoemelsoftware in dieselauto’s en fraude met CO2-emissiehandel.","605.1",NA
"De Europese Commissie moet meer handhavingsbevoegdheden krijgen voor Europese milieuregels en boetes op het overtreden van milieuregels moeten overal in Europa even streng zijn.","605.1",NA
"Tenslotte wil D66 dat een internationaal milieuhof wordt ingesteld, zodat iedereen op deze wereld zijn milieurecht kan halen.","605.1",NA
"Vooroplopen in duurzaam en sociaal ondernemen","H",NA
"Nederland is een wereldwijde koploper in duurzaam en sociaal ondernemen.","416.2",NA
"D66 is trots op grote en kleine Nederlandse bedrijven die de kansen en noodzaak zien om hun bedrijfsvoering fundamenteel te verduurzamen, verantwoordelijkheid nemen voor hun impact op de wereld om hen heen, zichzelf doelen stellen en hierover transparant rapporteren.","416.2",NA
"D66 wil dat de overheid deze beweging steunt, bijvoorbeeld door samenwerking in duurzame ketens te vereenvoudigen en te stimuleren.","416.2",NA
"Hoofdstuk 3 Meer werk – bereikbaar voor iedereen","H",NA
"Een van de belangrijkste redenen om nieuwe groei na te jagen is dat deze groei leidt tot werk.","402",NA
"Werk dat de kans biedt tot ontplooiing, dat leidt tot zelfredzaamheid en dat bijdraagt aan geluk.","402",NA
"Nederland is een geweldig land om in te werken – vol van kansen, vol van mensen met ambitie.","402",NA
"Maar er schort ook wat aan.","402",NA
"Op dit moment zijn er te veel mensen zonder werk.","402",NA
"Er is te weinig werk.","402",NA
"Werkgevers vinden het te duur en riskant om nieuwe werknemers aan te nemen.","402",NA
"Op de arbeidsmarkt groeit de tweedeling tussen insiders en outsiders.","503",NA
"Vooral jongeren en lager opgeleiden werken steeds langer via tijdelijke contracten en een vast contract is te vaak onbereikbaar.","503",NA
"Werknemers met een vast contract houden vast aan hun baan en te veel, met name oudere, werknemers komen tot de pijnlijke ontdekking dat zij na baanverlies niet makkelijk weer aan de slag komen.","503",NA
"Dwars door dit alles heen zien we een toename van zelfstandigen, waarbij we aan de ene kant zelfstandigen hebben die welvaren bij de gevonden flexibiliteit en ondernemerschap.","503",NA
"Aan de andere kant zien we zelfstandigen die grote moeite hebben om in hun levensonderhoud te voorzien, laat staan dat ze een arbeidsongeschiktheidsverzekering afsluiten of sparen voor hun pensioen.","503",NA
"Het aantal flexibele arbeidsrelaties blijft toenemen en dit gaat gepaard met de erosie van zekerheden die voor het individu, maar ook voor de samenleving als geheel van waarde zijn.","503",NA
