"text","cmp_code"
"Het gaat ten slotte om onze voedselvoorziening.","703"
"Die blijft belangrijk.","703"
"Kijk maar naar de wereldwijd toenemende vraag naar voedsel.","703"
"De genoemde sectoren hebben gezorgd voor een betaalbaar en veilig voedselpakket.","703"
"Met de aanpalende handel en verwerkende industrie is de agrarische sector een belangrijke pijler onder de Nederlandse economie.","703"
"Bovendien is de sector één van de belangrijkste dragers van een leefbaar platteland.","703"
"De SGP zal zich daarom in blijven zetten voor een levendige land- en tuinbouw en een vitale visserij.","703"
"De agrarische sector, en ook de visserij, hebben een bijzondere positie in markt en leefomgeving.","703"
"Het gaat om gezinsbedrijven die leveren aan een grote markt die steeds meer geliberaliseerd wordt.","703"
"Coöperatieve afzetorganisaties hebben nauwelijks mogelijkheden om te sturen, laat staan de individuele boer of tuinder.","703"
"Schaalvergroting en intensivering zijn dan onontkoombare trends.","703"
"Dat is begrijpelijk, maar het baart wel zorgen.","703"
"Dat is ook te merken aan de maatschappelijke druk tegen schaalvergroting en intensivering.","703"
"Het gaat immers niet om grote bedrijven, weggestopt op industrieterreinen, maar om bedrijven die een grote invloed hebben op onze leefomgeving.","703"
"Dit biedt een vat vol tegenstrijdige belangen en ontwikkelingen.","703"
"De komende jaren moeten belangrijke keuzes gemaakt worden.","703"
"De SGP gaat met open vizier voor een economisch weerbare  én maatschappelijk verantwoorde land-en tuinbouw en visserij.","703"
"Verdienen, samenwerken en innoveren zijn de kernelementen die maatschappelijke verantwoordelijkheid en economische weerbaarheid in elkaar kunnen vlechten.","411"
"De SGP kiest daarbij voor een constructieve opstelling.","703"
"Geen duimschroeven, maar gezamenlijk de hand aan de ploeg!","703"
"Steun voor gezinsbedrijven.","703"
"Zoeken naar toegevoegde waarde.","411"
"Ruimte voor samenwerking en krachtig innovatiebeleid.","411"
"De SGP wil hier extra geld voor uittrekken.","411"
"Concreet: Behoud van het Europees Gemeenschappelijk Landbouwbeleid en het instrument ‘directe inkomenssteun’ voor gezinsbedrijven is een voorwaarde voor een concurrerende en maatschappelijk verantwoorde land-en tuinbouw.","108"
"Voor wat (betaalbaar en veilig voedsel, vooruitstrevende regelgeving, landschapsinpassing), hoort wat (inkomenssteun).","703"
"De zogenaamde vergroening van het GLB moet behapbaar zijn.","703"
"Boeren moeten voldoende tijd krijgen om mee te schakelen.","703"
"Europese gelden voor plattelandontwikkeling moeten vooral op het boerenerf (agrarische sector en structuur) neerdalen.","703"
"Nederland moet in de regelgeving een gelijk speelveld tussen Europese lidstaten nastreven.","108"
"Papieren rompslomp en regeldruk moeten teruggedrongen worden.","303"
"De afschaffing van het belastingvoordeel op rode diesel dient teruggedraaid te worden.","703"
"De landbouwvrijstelling en de verlaagde energie-en omzetbelasting voor de glastuinbouw moeten worden gehandhaafd.","703"
"Bodemvruchtbaarheid krijgt prioriteit in het mestbeleid.","703"
"Reparatiebemesting voor bodemvruchtbaarheid moet mogelijk worden.","703"
"Er moet meer ruimte komen voor maatwerk per gebied.","301"
"Verplichte mestverwerking is noodzakelijk,","501"
"maar mag niet overhaast ingevoerd worden.","703"
"Ook moeten ondernemers die de mest in de omgeving van hun bedrijf kwijt kunnen zo min mogelijk lastig gevallen worden.","703"
"Mededingingsregels kunnen en moeten versoepeld worden.","703"
"Boeren, tuinders en vissers dienen meer ruimte te krijgen voor uitwisseling van markt-en prijsinformatie.","703"
"Dat geldt ook voor afspraken gericht op het doorberekenen van prijsverhogingen door investeringen in dierenwelzijn en milieu.","703"
"Jonge boeren verdienen steun.","703"
"Stimuleringsregelingen, met name voor bedrijfsovername, dienen overeind te blijven.","703"
"De SGP blijft zich verzetten tegen de onredelijke aanpak van landbouw-en visserijactiviteiten in en om Natura 2000-gebieden.","703"
"Beleid en wetgeving moeten versoepeld worden, bijvoorbeeld door het verschuiven van bewijslast van ondernemers naar overheden en bezwaarmakers.","703"
"De Europese teelt van eiwitrijke gewassen, als alternatief voor importsoja, moet gestimuleerd worden.","703"
"De professionele biologische landbouw verdient steun.","703"
"De biologische landbouw is een waardevolle kraamkamer voor verduurzaming van de gangbare landbouw.","416"
"De aanleg en ontsluiting van Greenports moet gestimuleerd worden.","703"
"De clustering van tuinbouwactiviteiten moet gefaciliteerd worden.","703"
"De veehouderij is vaak de gebeten hond.","703"
"Of het nu gaat om de uitstoot van ammoniak, de import van soja, het uitbreken van dierziektes, dierenwelzijn of ‘megastallen’.","703"
"De SGP kan de kritiek voor een deel onderschrijven.","501"
"Neem bijvoorbeeld het doden van mannelijke eendagskuikens, omdat alleen de vrouwtjes als leghennen gebruikt kunnen worden.","501"
"Mogen wij zo omgaan met schepselen van God?","603"
"De Bijbel geeft duidelijk aan dat dieren gebruikt mogen worden ten dienste van mensen, maar wel onder de voorwaarde, dat er goed voor gezorgd wordt.","603"
"Als dieren enkel als productiemiddel worden gezien, gaat het fout.","603"
"Hoewel vele veehouders hun dieren niet zo zien en met liefde hun vak uitoefenen, worden ze door globalisering en prijskritische consumenten wel op het pad van schaalvergroting en intensivering gestuurd.","416"
"Dat moet anders.","416"
"Vergaande regelgeving werkt contraproductief.","108"
"Nederland is immers geen eiland.","108"
"Ook moet eerst een boterham verdiend worden voordat geïnvesteerd kan worden in betere stallen.","703"
"De SGP kiest daarom voor een constructieve opstelling, voor het uitbreiden van positieve ontwikkelingen en initiatieven.","416"
"Niet alleen de veehouderij, maar ook supermarktketens en consumenten zullen hieraan hun steentje bij moeten dragen.","416"
"Het gezinsbedrijf is voor de SGP de gewenste schaalgrootte waarbij de zorg voor het dier het beste gewaarborgd is.","703"
"Concreet: Over de licht-en schaduwzijden van biologische en gangbare, extensieve en intensieve veehouderij in Nederland moet een fundamentele discussie gevoerd worden.","416"
"Het vermarkten van biologische producten, streekproducten en tussensegmenten moet gestimuleerd worden.","416"
"Hiervoor is samenwerking en afstemming in de keten nodig.","303"
"Weidegang moet gestimuleerd worden.","501"
"Samen met sector en wetenschap moet gezocht worden naar alternatieven voor ongewenste ontwikkelingen en ingrepen, zoals het doden van eendagskuikens.","501"
"Transporten van met name slachtvee over lange afstand moeten beperkt worden tot maximaal 500 kilometer of acht uur.","501"
"Het systeem van dierrechten wordt achter de hand gehouden om te voorkomen dat mestproductie en schaalvergroting uit de hand lopen.","501"
"Verplichte bedrijfsgezondheidsplannen dienen als basis voor het werken aan diergezondheid en dierenwelzijn.","501"
"Noodzakelijke reductie van het antibioticagebruik in de veehouderij vergt blijvende inspanning van veehouders en overheid.","501"
"Veehouders moeten ruimte blijven houden om zelf antibiotica toe te dienen.","703"
"Mededingingsregels moeten zo aangepast worden dat afspraken gemaakt kunnen worden over het doorberekenen van kostprijsverhogingen als gevolg van dierenwelzijnsmaatregelen.","703"
"Nederland en Europa moeten harder met de vuist op de WTO-tafel slaan om meer ruimte te krijgen voor ‘non trade concerns’ op het gebied van dierenwelzijn en milieu.","501"
"Massaal doden van vee en vernietiging van alle vlees bij uitbraken van dierziekten mag niet meer voorkomen.","501"
"Het aantal proefdieren kan omlaag.","501"
"Openheid moet actief bevorderd worden.","403"
"Alternatieven voor proefdieren verdienen (juridische) steun.","501"
"Mogelijk dierenleed als gevolg van onbedwelmde rituele slacht moet ingeperkt worden.","501"
"De SGP is tegen een verbod, maar pleit wel voor strengere regels.","501"
"Als het ‘koosjer’ plaatsvindt, kan veel dierenleed voorkomen worden.","501"
"De visserijsector zit in een transitieproces.","703"
"De mosselvisserij heeft helaas haar neus gestoten aan Natura 2000, maar heeft een uitweg gevonden.","703"
"De Noordzeevisserij heeft te kampen met hoge brandstofkosten, beperkende quota en concurrerende kweekvis.","703"
"Ook wordt zij op de huid gezeten door milieuorganisaties.","703"
"Innoveren is het toverwoord.","411"
"Dat moet zich niet alleen richten op de vangstmethode, maar ook op de marketing.","411"
"Daarvoor zijn tijd en steun onontbeerlijk.","703"
"Ook de beroepsmatige binnenvisserij beleeft moeilijke tijden.","703"
"De belangen van deze ondernemers verdienen meer aandacht.","703"
"De SGP zal zich in blijven zetten voor een vitale visserijsector.","703"
"Concreet: Europese regels, o.a. over aanlandingen, pk’s van kotters en palingvisserij, moeten in héél Europa identiek worden toegepast en daadwerkelijk worden gehandhaafd.","108"
"Ongewenste bijvangsten moeten verminderd worden, maar niet door een verplichting om alle bijvangsten aan wal te brengen (geen aanlandingsplicht).","703"
"Het natuurbeschermingsbeleid moet voldoende ruimte blijven bieden voor visserij op Noordzee en Waddenzee.","703"
"De visserijsector moet reële tijd krijgen voor verduurzaming.","703"
"Betrokkenheid van de sector is essentieel.","703"
"Het Masterplan Duurzame Visserij voor ombouw van de kottervloot krijgt voluit steun.","416"
"De schaduwzijden van kweekvis moeten meer voor het voetlicht gebracht worden.","703"
"Natuur en cultuur liggen in Nederland dicht bij elkaar.","501"
"Ze hebben elkaar voor een groot deel vormgegeven.","501"
"De diversiteit van natuur en landschap is groot.","501"
"Biodiversiteit is door God in de schepping gelegd, maakt de natuur weerbaar en is nuttig voor de mens.","603"
"Een gevarieerd landschap is mooi, geeft rust en mogelijkheden voor ontspanning.","501"
"Dat alles verdient bescherming.","501"
"Maar wel met een stukje nuchterheid.","703"
"Agrarische en andere bedrijven hebben een volwaardige plek in ons landschap, ook in en nabij natuurgebieden.","703"
"Dat moet zo blijven.","703"
"Helaas prevaleert kwantiteit tegenwoordig vaak boven kwaliteit.","703"
"De SGP draait dit graag om.","703"
"Concreet: De decentralisatie van het natuurbeleid naar provincies en de herijking van de Ecologische Hoofdstructuur moeten doorgezet worden.","301"
"De SGP kiest voor goed beheer van bestaande natuurgebieden","501"
"en wil de ontwikkeling van nieuwe natuur inperken.","703"
"Dat betekent: meer geld voor natuurbeheer, minder geld voor nieuwe natuur.","501"
"Private financiering van natuurontwikkeling en –beheer verdient een steun in de rug, bijvoorbeeld door een revolverend fonds voor laagrentende en langlopende leningen, naar analogie van het succesvolle nationaal restauratiefonds voor monumenten.","501"
"Beleidsdoelen voor biodiversiteit, recreatie en landschap moeten zoveel mogelijk in dezelfde gebieden gerealiseerd worden, zodat op een kleinere oppervlakte meer bereikt kan worden.","303"
"Natuurontwikkeling en –beheer door agrariërs en particulieren heeft de voorkeur boven verwerving van landbouwgrond voor natuur door de overheid.","703"
"De taakstelling hiervoor moet uitgebreid worden.","703"
"Vergoedingen en contracten voor agrarisch en particulier natuurbeheer moeten reëel en aantrekkelijk zijn.","703"
"Verbindingszones tussen natuurgebieden moeten zoveel mogelijk via agrarisch en particulier natuurbeheer gerealiseerd worden.","703"
"Er moet structureel beleid komen voor leegstaande stallen en schuren.","703"
"Verpaupering kan zo voorkomen worden.","703"
"Goede landbouwgrond mag niet ontpolderd worden.","703"
"Dit principe blijft ook gelden voor de Hedwigepolder en het hele Westerscheldegebied.","703"
"Natuurherstel moet zoveel mogelijk plaatsvinden via buitendijkse maatregelen en zo min mogelijk via ontpoldering.","703"
"De ordening van onze schaarse ruimte is een lastige opgave.","408"
"Woningbouw, bedrijvigheid, natuur, landbouw, wegen, alles heeft een plekje nodig en liefst niet teveel door elkaar.","408"
"De SGP staat achter het motto ‘decentraal wat kan, centraal wat moet’.","301"
"Tegenover de tendens dat de landelijke overheid steeds meer de regie naar zich toe trekt, zet de SGP in op de vrijheid voor gemeenten om waar mogelijk een eigen beleid te voeren.","301"
"Binnen duidelijke randvoorwaarden moeten gemeenten er voor kunnen zorgen dat aan de lokale behoeften van burgers en bedrijven zoveel mogelijk voldaan kan worden.","301"
"Dat geldt niet alleen voor gemeenten in het stedelijk gebied, maar ook in het landelijk gebied!","301"
"Concreet: Bouwregelgeving en ruimtelijke procedures moeten vereenvoudigd worden.","303"
"Onteigeningsprocedures mogen niet versoepeld worden.","401"
"De huidige taken van gemeenten ten aanzien van ruimte en milieu moeten zoveel mogelijk bij de gemeente blijven.","301"
"Samenwerking moet van onderop vormgegeven worden.","301"
"Het basistakenpakket van regionale omgevingsdiensten moet daarom beperkt blijven.","301"
"Herstructurering van verouderde bedrijventerreinen heeft de voorkeur boven de aanleg van nieuwe.","416"
"Er moeten voldoende mogelijkheden blijven voor lokale bedrijventerreinen.","301"
"Goede afstemming van regionale en lokale vraag naar en beschikbaarheid van bouwlocaties en geconcentreerde spreiding van de regionale locaties gaat ‘verrommeling’ van het landschap tegen.","408"
"Ruimtelijke en economische ontwikkeling buiten de Randstad, bijvoorbeeld in Noord-Nederland, moet meer aandacht krijgen.","301"
"Al jaren staat het sein voor de woningmarkt op rood.","408"
"De doorstroming schiet tekort.","408"
"Teveel mensen zitten in een sociale huurwoning (scheefwonen) of hebben recht op huurtoeslag, terwijl ze een eigen woning aan kunnen.","505"
"Voor starters is het lastig om de woningmarkt op te komen.","408"
"Hier is de financiële en economische crisis bovenop gekomen.","408"
"De huizenmarkt zit nu helemaal vast.","408"
"Dat is niet alleen slecht voor degenen die een huis zoeken (vooral starters!), maar ook voor de bouw.","408"
"Als nu snel en doortastend wordt gehandeld, snijdt het mes aan twee kanten.","408"
"Kern van de oplossing die de SGP voorstelt, is het bevorderen van het aflossen van leningen","408"
"en starters meer kansen geven zodat de doorstroming op gang komt.","408"
"Concreet: De hypotheekrenteaftrek wordt geleidelijk hervormd.","408"
"Elke bespaarde euro geeft de overheid terug via verlaging van de belasting op arbeid, afschaffing van de overdrachtsbelasting en afbouw van het eigen woningforfait.","408"
"Pensioenopbouw, aflossing hypotheken en zorg worden aan elkaar gekoppeld, bijvoorbeeld doordat een deel van de pensioenopbouw gebruikt mag worden voor aflossing van de hypotheek zodat dat later gebruikt kan worden voor de kosten van de oude dag.","408"
"Ouders kunnen belastingvrij hun kinderen helpen bij aanschaf van een woning of bij aflossing van de hypotheek.","408"
"Starters op de woningmarkt kunnen een starterslening krijgen.","408"
"Starters mogen de aflossing van hun hypotheekschulden over een langere periode uitsmeren, zodat hun maandlasten lager worden.","408"
"Banken moeten eerder hypotheken verstrekken aan mensen met een tijdelijk contract.","408"
"Het scheefwonen en de huurtoeslagen voor huishoudens die deze niet echt nodig hebben, worden aangepakt.","505"
"De overheid draagt zorg voor betaalbare huurwoningen .","504"
"Achterstanden bij de restauratie van monumenten moeten teruggedrongen worden.","502"
"De subsidieregeling moet meerjarig zekerheid bieden voor aanvragers.","502"
"Kerkelijke organisaties krijgen voldoende ruimte om in de subsidieregeling mee te doen als professionele organisatie.","607"
"Herbestemming van monumenten wordt gestimuleerd.","408"
"In het geval van kerken moet voldoende recht worden gedaan aan de bijzondere functie en waarde van het gebouw.","603"
"Woningcorporaties moeten hun maatschappelijke taak meer in het oog houden.","403"
"Het voorzieningenniveau in kleine plattelandskernen en krimpregio’s (op korte termijn vooral in delen van Groningen, Limburg en Zeeland) moet op peil blijven.","408"
"Het Internationaal Energie Agentschap waarschuwt in haar jaarlijkse Word Energy Outlook voor een oliecrisis en voor een dreigende klimaatramp als gevolg van de CO2-uitstoot.","501"
"Het tekent twee belangrijke spitsen van het energie-en milieubeleid.","408"
"Nationaal en internationaal.","107"
"Het rentmeesterschap waar de SGP voor staat, vraagt immers verantwoord om te gaan met de door God toevertrouwde primaire energiebronnen.","603"
"Vermindering van de CO2-uitstoot en de koppeling van energienetten en –markten moeten de belangrijke thema’s op Europees niveau zijn.","108"
"Het CO2-emissiehandelssysteem kan een effectief instrument zijn, maar laat nu nog te weinig haar tanden zien.","501"
"Dat moet anders.","501"
"De SGP vindt het verstandig om op nationaal niveau het accent te leggen op het garanderen en betaalbaar houden van onze toekomstige energievoorziening.","408"
"Reductie van de CO2-uitstoot is van belang, maar wekt niet het brede maatschappelijke gevoel van urgentie op dat nodig is om veranderingen door te zetten.","408"
"De macht van oliesjeiks en gasrijke landen over de olie-en gaskraan is een meer tastbare dreiging dan het onzichtbare CO2.","408"
"Bovendien raakt de energievoorziening direct het nationale wel en wee.","408"
"Dat moet worden benut.","408"
"Het een sluit het ander niet uit.","416"
"Juist niet.","416"
"Het vermeden gebruik van fossiele energiebronnen is direct gekoppeld aan vermeden CO2-emissie.","416"
"Strategisch beleid, met het bijbehorende instrumentarium, moet zich naast de korte termijn ook richten op de lange termijn.","408"
"Bedrijven moeten hierbij ruimte krijgen om eigen keuzes te maken.","401"
"Zo kunnen onderzoekers, bedrijven en decentrale overheden aan de slag!","408"
"Concreet: Nederland moet zich inzetten voor internationale samenwerking bij het ontwikkelingen van duurzame technologie.","416"
"Hier liggen kansen voor Nederlandse onderzoekers en bedrijven.","416"
"Nederland moet op Europees niveau pleiten voor een effectiever CO2emissiehandelssysteem, zodat een hogere CO2-prijs gerealiseerd wordt en papieren CO2-reductie vermeden wordt.","501"
"Inkomsten moeten deels naar de energie-intensieve industrie teruggesluisd worden om te voorkomen dat de internationale concurrentiepositie van deze industrie verzwakt.","406"
"De SGP is kritisch over de stapeling van regels vanuit Brussel.","110"
"Dat geldt ook voor milieu-en energieregels.","110"
"Voor CO2-emissiehandel is een Europese aanpak nodig, voor energiebesparing niet.","110"
"De effectiviteit van het energiebeleid moet omhoog.","303"
"Regels, belastingen en subsidies hebben de voorkeur boven vrijblijvende convenanten.","303"
"Ook moet de overheid langjarige zekerheid bieden aan het bedrijfsleven.","401"
"Wisseling van beleid zorgt voor onzekerheid en remt bedrijven af.","401"
"De zogenaamde Green Deals vormen een goed instrument, mits de vrijblijvendheid er af gaat.","501"
"Nationale doelstellingen voor hernieuwbare energie worden in overeenstemming gebracht met EU-doelstellingen.","108"
"Een hoger ambitieniveau is wenselijk, maar mag niet de grondslag worden voor (wettelijke) overheidsmaatregelen als concurrerende landen dat evenmin doen.","401"
"Europese energiemarkten en –netten moeten zoveel mogelijk geïntegreerd worden.","108"
"De SGP vindt dat het maken van keuzes voor bepaalde vormen van duurzame energieopwekking en energiebesparing zoveel mogelijk aan de markt overgelaten moet worden.","401"
"Doelstellingen moeten dan wel wettelijk vastgelegd worden.","403"
"Een verplichting voor alle Nederlandse energieleveranciers om een oplopend percentage duurzaam geproduceerde elektriciteit, gas en warmte te leveren is een goede optie.","416"
"De SGP wil uitbreiding van de regeling voor zelflevering van groene stroom.","416"
"Burgers en bedrijven die zelf groene stroom opwekken, bijvoorbeeld door zonnepanelen op eigen dak, hoeven over dat deel geen energiebelasting te betalen.","416"
"Deze regeling moet uitgebreid worden naar kleinschalige projecten waarbij burgers en bedrijven samen investeren in decentrale opwekking van groene stroom.","416"
"Energiebesparing is goedkoper dan de productie van duurzame energie.","416"
"Hier moet voluit op ingezet worden.","416"
"Het is meer de hoge investeringsdrempel dan de terugverdientijd die burgers en bedrijven weerhoudt van investeren in energiebesparing.","416"
"Er moet daarom een revolverend fonds komen die burgers en bedrijven over deze investeringsdrempel heen helpt.","416"
"Voor grootschalige verduurzaming van onze energievoorziening en energie-efficiency is innovatie nodig.","416"
"Europees gezien kan Nederland een belangrijkere rol spelen in de ontwikkeling en productie van hoogwaardige technologie dan in de energieproductie zelf.","416"
"Nederland kan daar ook een slaatje uit slaan.","416"
"Deze kansen moeten benut en gestimuleerd worden.","416"
"De SGP wil daar extra geld voor uittrekken.","416"
"De inzet van warmtekrachtkoppeling (wkk) in energie-intensieve industrie en glastuinbouw moet gestimuleerd en, eventueel, op termijn verplicht worden, onder voorwaarde dat warmte nuttig gebruikt wordt.","416"
"Zolang schone energiebronnen niet toereikend zijn, is de benutting van kernenergie en aardgas een aanvaardbare tussenoplossing.","408"
"Een evenwichtig samengestelde brandstofmix verbetert de betaalbaarheid en stabiliteit van de energievoorziening.","408"
"Met de benutting van kernenergie en aardgas kan ook een schoner tegenwicht geboden worden aan de bouw van conventionele kolencentrales.","408"
"Een bouwstop voor kolencentrales gaat de SGP een stap te ver.","408"
"Energiebedrijven hebben immers al te maken met het dalende CO2-plafond van het Europese CO2-emissiehandelssysteem, moeten ook anticiperen op het oplopende verplichte percentage duurzame energie voor energieleveranciers en kunnen in de kolencentrales biomassa meestoken.","408"
"Bij vormgeving en plaatsing van windmolens en windmolenparken moet meer rekening gehouden worden met de omgeving.","408"
"De bouw van het windmolenpark bij Urk gaat niet door.","408"
"De energienormen voor nieuwbouwwoningen en utiliteitsbouw moeten aangescherpt worden.","416"
"Milieu is meer dan CO2.","501"
"Ook afval, fijn stof en legionella leveren problemen op.","501"
"De zorg voor gezond water, een gezonde lucht en een schone bodem is in de eerste plaats een verantwoordelijkheid voor burgers en bedrijven.","401"
"Hier is echter ook een taak weggelegd voor de overheid.","403"
"Goed gedrag moet gestimuleerd worden.","501"
"Uitwassen moeten bestreden worden.","605"
"Toepassing van het principe ‘de vervuiler betaalt’ gaat ook de gebruiker aan.","501"
"Concreet: Het gebruik van vuurwerk moet sterk ontmoedigd worden door een vuurwerkheffing, beperking van de verkoop en het toewijzen van afsteeklocaties.","501"
"De normering van de luchtkwaliteit moet toegesneden worden op de luchtdeeltjes die daadwerkelijk schadelijk zijn (bijvoorbeeld zwarte rook).","501"
"Technologie, biotechnologie en andere technologieën bieden wetenschappers en bedrijven steeds meer mogelijkheden om het leven op aarde naar eigen hand te zetten, of zelfs van de grond af aan op te bouwen.","603"
"Althans, zo spreken zij erover.","603"
"Ze leveren er de nodige vergezichten bij.","603"
"De SGP is uiterst kritisch.","603"
"God heeft het leven geschapen.","603"
"De natuurlijke grenzen die in Zijn schepping liggen, zijn er niet voor niets.","603"
"De voortschrijdende potentie van bijvoorbeeld nano-en biotechnologie roept in heel de maatschappij fundamentele vragen op: wat is leven eigenlijk?","603"
"Waar de moderne mens zichzelf tot maat van alle dingen heeft verklaard en niet goed raad weet met deze fundamentele vragen, heeft de SGP hier wel een duidelijke visie op.","603"
"God heeft het leven geschapen.","603"
"Zijn Woord is de maat van alle dingen.","603"
"Concreet: De SGP is tegen genetische modificatie van dieren.","603"
"De SGP is ook tegen genetische modificatie van gewassen als genen van niet aanverwante soorten ingezet worden.","603"
"Bij zwaarwegende humane, medische redenen kan hierop een uitzondering gemaakt worden.","504"
"De overheid moet zorg dragen voor een voedselketen die vrij is van genetisch gemodificeerd materiaal.","603"
"Het octrooirecht op genen, planteigenschappen en plantenrassen moet herzien worden.","603"
"Het mag de klassieke plantenveredeling in ieder geval niet dwarszitten.","703"
"Het maatschappelijk debat over de ontwikkeling en toepassing van technologieën die vergaande invloed hebben op het leven op aarde moet vroegtijdig geïnitieerd en gevoerd worden.","603"
"Mobiliteit is voor mensen erg belangrijk.","411"
"Voor het werk, voor sociale contacten en voor recreatie.","411"
"SGP kiest daarom voor beleid, waarin auto en OV op waarde worden geschat.","411"
"Een beleid dat zich kenmerkt door een nuchtere kijk op mobiliteit.","411"
"Mobiliteit is onmisbaar.","411"
"Tegelijkertijd is helder, dat mobiliteit niet onbeperkt genoten kan worden.","501"
"Dat zou geen recht doen aan de vele afwegingen en spanningsvelden die een rol spelen rond mobiliteit: leefbaarheid, veiligheid, schone lucht, gezonde natuur, verantwoord energiegebruik, voldoende stilte en rust.","501"
"Waarden die iedere burger óók gehonoreerd wil zien.","501"
"Daarom bepleit de SGP een uitgekiend ruimtelijk beleid om mobiliteit te verminderen.","416"
"Bijvoorbeeld door middel van een intelligent locatiebeleid kunnen hier serieuze slagen worden gemaakt.","416"
"Ook op fiscaal terrein kunnen maatregelen worden genomen om mobiliteit te remmen.","408"
"Het afschaffen van de overdrachtsbelasting kan mensen stimuleren om dichter bij het werk te gaan wonen.","408"
