"text","cmp_code"
"De SGP verwerpt de forenzenbelasting.","408"
"Ook op het terrein van transportpreventie valt het nodige te winnen.","408"
"Concreet voor wegen: Een robuuste inzet ten aanzien van het oplossen van knelpunten op hoofdwegen en hoofdspoor is hard nodig.","411"
"Als veiligheid en milieu het toelaten, is 130 km/u op de snelweg aanvaardbaar.","411"
"Daarnaast moet meer ruimte worden geboden aan dynamisch snelheidsbeheer: sneller waar het kan, langzamer waar het moet.","303"
"Het Rijk moet zich niet alleen richten op investeringen in de Randstad, maar ook op het gebied daarbuiten (Gelderland, Zeeland, Noorden).","301"
"De SGP bepleit een eenduidig en begrijpelijk systeem van autobelastingen.","303"
"Door een stapeling van fiscale vergroeningsmaatregelen wordt het huidige systeem te complex.","303"
"De mogelijkheden van kilometerbeprijzing moeten bezien worden.","408"
"Het moet wel technisch haalbaar en betaalbaar zijn.","408"
"Bovendien dienen we zeer terughoudend te zijn om juist de economisch meest actieven extra te belasten voor hun kilometers.","408"
"Er komt een verbod op vrachtverkeer op zondag, zoals dat ook in verschillende andere Europese landen geldt.","408"
"Er moet zoveel mogelijk gesneden worden in het oerwoud van verkeersborden.","303"
"De overheid schept randvoorwaarden waarmee schone vormen van vervoer worden gestimuleerd: elektrisch rijden, rijden op aardgas, groen gas, biobrandstoffen, waterstof en hybride rijden.","416"
"Het Rijk moet met kracht werken aan een integrale, niet-gefaseerde uitvoering van het voorkeursalternatief van de Rijnlandroute.","411"
"Concreet voor fietsen: Gemeenten, provincies en waterschappen moeten gestimuleerd worden om aantrekkelijke fietspaden aan te leggen en te verbeteren.","411"
"Dit geldt ook de faciliteiten voor elektrisch fietsen.","411"
"Verdere uitbreiding van het netwerk van regionale snelfietsroutes tussen woon-en werklocaties is nodig.","411"
"Het tekort aan (gratis) fietsstallingen moet worden weggewerkt.","411"
"Fietsen wordt een expliciet aandachtspunt in het gezondheidsbeleid.","504"
"De verkeersveiligheid wordt vergroot door een steviger inzet op ontvlechting van fietsroutes en routes voor gemotoriseerd verkeer.","411"
"Concreet voor verkeersveiligheid: Verkeersveiligheid krijgt hoge prioriteit.","411"
"Drugs en alcohol in het verkeer moeten volledig worden uitgebannen.","605"
"Concreet voor de binnenvaart: Knelpunten in de vaarwegen moeten zo snel mogelijk worden weggewerkt.","411"
"Dit geldt ook de kleinere vaarwegen als haarvaten van het systeem.","411"
"Er mag geen nieuw achterstallig onderhoud ontstaan.","411"
"Het Rijk moet de gevolgen van de crisis voor de binnenvaart bestrijden.","411"
"Het perspectief voor de binnenvaart is over enige jaren veel gunstiger.","411"
"Daarom is van belang dat een koude sanering wordt voorkomen en extra wordt ingezet op maatregelen om de sector te versterken (Modal Shiftbeleid, Quick Wins Verladers en kleine vaarwegen).","411"
"Goederenvervoer over water is favoriet bij de SGP.","411"
"De Betuweroute mag geen valse concurrentie opleveren.","411"
"De papieren rompslomp moet tot een minimum worden teruggebracht.","303"
"Concreet voor het spoor: Openbaar vervoer moet goed toegankelijk zijn voor gehandicapten.","705"
"Het Rijk moet meer investeren in regionaal openbaar vervoer.","411"
"Niet de vervoervraag moet leidend zijn, maar de ambitie om regionaal OV op te plussen tot een samenhangend netwerk van OV.","411"
"Juist in dichtbevolkte gebieden, zoals Zuid-Holland, is nog veel te winnen.","411"
"Zie het succes van Randstadrail.","411"
"Er gaapt een kloof tussen de mogelijkheden en de financiële middelen die de decentrale overheden ontvangen.","301"
"Concreet voor de luchtvaart: De luchthaven Schiphol loopt tegen haar grenzen aan.","411"
"De aanleg van een luchthaven in zee moet tot de mogelijkheden blijven behoren.","411"
"Onderzoek hiernaar moet doorgang vinden.","411"
"De invoering van accijns op kerosine moet Nederland in internationaal verband sterk bevorderen.","501"
"Concreet voor veerdiensten: Veerdiensten verdienen steun.","411"
"Ze voorkomen jaarlijks maar liefst 333 miljoen omrijkilometers.","411"
"Dit voorkomt veel uitstoot en bovendien veel verkeersslachtoffers.","411"
"Het Rijk moet bevorderen dat de noodzakelijke verjonging en innovatie van de veerpontenvloot serieus gestalte krijgt.","411"
"Wereldwijd stijgt de zeespiegel, terwijl de westkant van Nederland kampt met bodemdaling.","411"
"Tegelijkertijd neemt de rivierafvoer toe.","411"
"Dat is een proces, waarop we tijdig moeten reageren.","411"
"De SGP beklemtoont, dat het onnodig is om elkaar angstscenario’s aan te praten.","411"
"Het beveiligingsniveau tegen hoog water is in Nederland groot, maar moet op onderdelen beter.","411"
"Technisch is dit prima realiseerbaar.","411"
"Dat betekent voor de SGP allereerst dat dijken verder versterkt en opgehoogd moeten worden.","411"
"Dit geeft het minste ruimtebeslag, is effectief en relatief betaalbaar.","411"
"De SGP bepleit vooral inzet op het klassieke instrumentarium, zoals kustversterking en dijkverhoging.","411"
"In allerlei modieuze ideeën, zoals tulpeneilanden in zee, zien wij niets.","305"
"De veiligheid van ons land is gediend met een nuchtere en zakelijke benadering.","305"
"Bij deze nuchtere benadering hoort ook dat wij zo snel mogelijk de geconstateerde achterstanden bij dijkversterkingen inhalen.","411"
"Concreet: Er liggen grote wateropgaven.","411"
"Daarom moeten we geen tijd en energie verspillen met structuurdiscussies.","305"
"Waterschappen hebben zich al eeuwen op positieve wijze bewezen.","301"
"Hun bestaansrecht is daarom geen punt van discussie.","301"
"Aan de zelfstandige positie van waterschappen mag niet worden getornd.","301"
"De benodigde financiële middelen voor waterveiligheid worden voor de lange termijn veilig gesteld via het Deltafonds.","411"
"Laten wij onze ondergrondse rijkdom – aardgasbaten – omzetten in bovengrondse veiligheid.","411"
"De SGP vindt het ongewenst om het waterpeil van het IJsselmeer met 1,5 meter te verhogen, zoals is voorgesteld door de Deltacommissie.","408"
"Onderzoek naar alternatieven moet worden bevorderd.","408"
"Verzilting is een groeiend probleem.","501"
"In het Deltaprogramma moet hier voldoende aandacht voor zijn.","501"
"Bij nieuwe bouwplannen moet meer rekening gehouden worden met waterveiligheid.","411"
"Onverstandige bouwprojecten in kwetsbare gebieden moeten voorkomen worden door het eerder inzetten van de watertoets","403"
"en de mogelijkheid voor waterschappen om in beroep te gaan tegen ‘onveilige’ bestemmingsplannen.","305"
"Dat wij ons dagelijks brood ontvangen, is geen vanzelfsprekende zaak.","107"
"In grote delen van de wereld is honger een dagelijkse werkelijkheid.","107"
"Wat dat betreft zijn we in Nederland rijk gezegend.","601"
"Van dat besef kunnen we niet genoeg doordrongen zijn.","401"
"Het is de verantwoordelijkheid van elke burger zich in te spannen om in zijn eigen levensonderhoud te voorzien.","401"
"De Heere heeft hiervoor ieder mens talenten en gaven gegeven.","603"
"De mens heeft de opdracht gekregen de aarde te bouwen en te bewaren.","603"
"Wanneer mensen niet of slechts in geringe mate inhoud kunnen geven aan deze verantwoordelijkheid heeft de overheid een taak om hen daarbij te helpen en zo nodig te ondersteunen.","503"
"Deze overheidssteun dient erop gericht te zijn dat mensen niet onnodig en te lang afhankelijk zijn van de overheid.","201"
"Het is zaak dat mensen weer zo snel en zo veel mogelijk zelfstandig aan de maatschappij kunnen deelnemen.","201"
"Een gezonde economische basis in onze maatschappij is onmisbaar om onze verantwoordelijkheid als rentmeester invulling te kunnen geven.","408"
"De rol van de overheid is daarbij tweeërlei.","408"
"Aan de ene kant dient de overheid de in de samenleving aanwezige talenten en potenties aan te moedigen.","402"
"Wanneer het particulier initiatief tot zijn recht komt, kan iedereen zijn persoonlijke verantwoordelijkheid als rentmeester vorm en inhoud geven.","401"
"Aan de andere kant heeft de overheid de taak duidelijke grenzen te stellen, omdat ook in het economisch leven de ongebondenheid van de mens openbaar komt.","403"
"Om zelfverrijking ten koste van anderen, uitbuiting van de aarde en roofbouw op toekomstige generaties tegen te gaan, is een heldere en duidelijke normstelling door de overheid broodnodig.","403"
"De zondag is een bijzondere dag.","603"
"De SGP vindt het belangrijk dat deze opstandingsdag van Christus uniek blijft.","603"
"Het is een groot voorrecht om één dag te hebben voor kerkgang, het luisteren naar het Woord van God en onderlinge ontmoeting.","603"
"Deze dag is niet alleen vanwege het christelijke karakter van belang, maar ook vanwege de belangrijke maatschappelijke en sociale waarde.","603"
"Ieder mens heeft er recht op om op adem te kunnen komen.","603"
"Dat geldt voor werknemers, maar ook voor (kleine) winkeliers.","603"
"Dat zal ook in de komende periode de inzet van de SGP zijn.","603"
"In de praktijk zien we veel niet-noodzakelijk werk gebeuren op zondagen.","603"
"Vooral de laatste jaren is er een tendens om op zondag de winkels vaker of zelfs altijd open te stellen.","603"
"Deze ontwikkeling – vooral gestimuleerd door het grootwinkelbedrijf -moet stoppen.","603"
"Ze leidt alleen tot overwerkte kleine ondernemers en saaie, eentonige winkelstraten.","603"
"Meer dan ooit is een dag van bezinning en collectieve rust van groot belang.","603"
"De zondag is niet bedoeld om allerlei evenementen en verkoopactiviteiten te ontplooien.","603"
"Concreet: De Zondagswet moet worden gehandhaafd en verbeterd, zodat de waarde van de zondag weer meer tot zijn recht komt.","603"
"Handhaving van de wetten die de positie van de zondag moeten beschermen moet weer prioriteit krijgen bij gemeenten.","603"
"De regering moet gemeenten hiervoor duidelijke handvatten bieden.","603"
"Winkels dienen op zondag gesloten te zijn.","603"
"De uitzondering in de Winkeltijdenwet voor twaalf koopzondagen per jaar moet vervallen.","603"
"Steeds meer gemeenten verklaren zich toeristisch om elke zondag open te kunnen zijn.","603"
"Aan dit groeiende misbruik van de Winkeltijdenwet moet een krachtig halt toegeroepen worden.","603"
"De toerismebepaling kan beter worden geschrapt.","603"
"Supermarkten die gebruik maken van de regeling voor avondwinkels om op zondagmiddag en -avond open te kunnen zijn, misbruiken de mogelijkheden die de wet biedt.","603"
"Deze bepaling mag alleen gelden voor échte avondwinkels, waarbij de zondag ontzien moet worden.","603"
"De wonderlijkste feestdagen gelden als alibi om op zondag open te kunnen zijn.","603"
"Ook die optie moet vervallen.","603"
"Uitgangspunt van de Arbeidstijdenwet moet worden dat op zondag alleen ‘werken van noodzakelijkheid en barmhartigheid’ zijn toegestaan.","603"
"Werknemers en winkeliers die niet op zondag willen werken, mogen op geen enkele manier worden gedwongen op zondag beschikbaar te zijn en mogen van hun keuze geen nadelige gevolgen ondervinden.","603"
"Gemeenten moeten met hun belangen uitdrukkelijk rekening houden.","603"
"Ook mag de Arbeidsinspectie niet langer wegkijken.","603"
"Om onnodig zondagswerk te voorkomen, moet innovatie mede gericht zijn op technologische ontwikkelingen die volcontinuprocessen overbodig maken.","603"
"De SGP blijft zich sterk maken voor het Nederlandse bedrijfsleven.","401"
"Bedrijven zorgen voor banen en werkgelegenheid.","401"
"Ondernemers exporteren producten en noteren zwarte cijfers in het Nederlandse huishoudboekje.","401"
"We moeten hen niet dwarszitten met regels en rompslomp, maar hun juist ruimte bieden.","401"
"Zeker nu.","401"
"Het economisch tij is de afgelopen jaren drastisch gekeerd.","401"
"Bedrijven in verschillende sectoren moeten alle zeilen bijzetten om het hoofd boven water te houden.","401"
"De overheid is er niet voor om alle bedrijven door de crisis heen te helpen.","401"
"Voor behoud van gezonde bedrijvigheid en ondernemerschap zullen tijdens een crisis de minst veerkrachtige bedrijven afvallen.","401"
"De overheid heeft wel een taak als het gaat om het faciliteren van een gezonde bedrijfsvoering, met oog voor belemmeringen en voor de toekomst.","402"
"Dat betekent dat de overheid wel een rol kan spelen als veerkrachtige bedrijven tijdelijk in de problemen komen.","402"
"Concreet: De SGP zal zich sterk maken voor de positie van het Midden-en Kleinbedrijf.","401"
"Het MKB is de motor van de Nederlandse bedrijvigheid en werkgelegenheid, maar moet het in de aandacht regelmatig afleggen tegen de grote bedrijven.","401"
"Het moet makkelijker worden om een bedrijf te starten of over te nemen.","401"
"Onnodige belemmeringen voor beginnend ondernemerschap moeten weggenomen worden.","401"
"De SGP zet zich in voor een goed functionerende scheepsbouwregeling.","401"
"Met de geboden borgstelling kan worden voorkomen dat goed draaiende werven de deuren moeten sluiten, omdat ze tijdelijk in zwaar weer verkeren.","402"
"Nederland zal erop aandringen dat concurrentieverstorende steun in andere (Europese) landen effectief wordt tegengegaan.","407"
"De overheid moet al het mogelijke doen om de regeldruk en administratieve lastendruk omlaag te brengen.","401"
"Bij het vormgeven van nieuwe regelgeving moet dit aspect zwaar wegen.","401"
"Ook bestaande regelgeving moet op dit punt regelmatig tegen het licht gehouden worden.","401"
"Zo vinden wij het nodig na te gaan welke Arboregels echt noodzakelijk zijn, en welke geschrapt kunnen worden.","401"
"De kleinere bedrijven verdienen hierbij speciale aandacht, omdat de papieren rompslomp bij deze bedrijven relatief grote gevolgen heeft.","401"
"Er moet een permanente versoepeling van de urennorm voor ZZP’ers komen, zodat het gemakkelijker wordt om in aanmerking te komen voor de fiscale voordelen.","401"
"De voorgestelde betaling van de WW door de werkgever wordt teruggedraaid.","401"
"Loondoorbetaling bij ziekte wordt stevig ingeperkt.","505"
"Er blijft voldoende subsidie beschikbaar voor initiatieven van het bedrijfsleven om de veiligheid van ondernemers, met name winkeliers, te waarborgen.","605"
"Bedrijven staan te springen om technici en afgestudeerde bèta-studenten.","506"
"Hier ligt een taak voor de overheid.","506"
"De SGP wil ondermeer dat beurzen voor bèta-studies aangeboden worden.","506"
"Om de prikkel tot ondernemerschap te vergroten en de concurrentiepositie van Nederlandse bedrijven te verbeteren, wordt de vennootschapsbelasting verlaagd.","402"
"De economische crisis is mede veroorzaakt door te risicovolle investeringen.","403"
"Er moet beter toezicht komen op de financiële sector.","403"
"Bonussen die aanzetten tot risicovol beleggen en investeren, moeten zoveel mogelijk worden ingedamd.","403"
"De economische ontwikkeling van gebieden buiten de Randstad en andere stedelijke gebieden moet meer aandacht krijgen.","301"
"Het concept ‘Maatschappelijk Verantwoord Ondernemen’ is in verschillende sectoren en branches nog geen gemeengoed.","416"
"De verschillen zijn groot.","416"
"Met een sector-en branchespecifieke aanpak om MVO van de grond te krijgen, is nog een wereld te winnen.","416"
"De wereldwijde concurrentie tussen bedrijven neemt toe.","411"
"Nederlandse bedrijven zullen het daarbij niet moeten hebben van goedkope arbeidskrachten, maar van kennis en innovatiekracht.","411"
"Daar moet de overheid op insteken.","411"
"De wil is er.","411"
"De praktijk is echter nog weerbarstig.","411"
"Meer innovatie is niet alleen goed voor de concurrentiekracht,","411"
"maar het is ook de sleutel voor bijvoorbeeld verduurzaming van onze energievoorziening of het efficiënter maken van productieprocessen.","416"
"Concreet: De overheid moet meer investeren in onderwijs en kennisopbouw.","506"
"Daar wordt de basis gelegd voor toekomstige innovatie.","506"
"Dan gaat het dus niet alleen om de initiële scholing, maar ook om levenslang leren.","411"
"Bij-en omscholing is van groot belang, voor jong en oud.","411"
"Startende, innovatie bedrijven zijn de TomTom’s van de toekomst, maar redden het vaak niet omdat investeerders het niet aandurven.","402"
"De SGP wil daarom voor startende bedrijven de loonkostenaftrek (WBSO) verruimen en extra ruggensteun bieden via het MKB+-innovatiefonds (inclusief extra budget).","402"
"Veel kennis blijft bij universiteiten op de plank liggen.","411"
"Universiteiten moeten geprikkeld worden om deze kennis te ‘verkopen’ of te benutten voor ontwikkeling van nieuwe producten.","411"
"Samenwerking tussen bedrijven ten behoeve van innovatie, alsook betrokkenheid van kennisinstellingen hierbij, moeten gestimuleerd en gefaciliteerd worden.","411"
"De aanpak via topsectoren moet daarom doorgezet worden.","411"
"Voor de belangrijkste topsectoren trekt de SGP extra geld uit.","411"
"De opstart van bedrijven die gelieerd zijn aan universiteiten, met name door afgestudeerden, moet gestimuleerd worden.","411"
"Verduurzaming van de energievoorziening en het aanpakken van de zorguitgaven zijn belangrijke opgaven voor de toekomst.","416"
"Innovatie is daarvoor een belangrijk middel.","411"
"De overheid moet daarin investeren.","411"
"Werken is waardevol.","701"
"Niet alleen voor het inkomen, maar ook voor ervaring en kennis die daardoor wordt opgedaan en voor de sociale contacten via de werkkring.","701"
"Wie werkt, vereenzaamt doorgaans niet.","701"
"De SGP hanteert het uitgangspunt dat huishoudens in eerste instantie zelf verantwoordelijk zijn voor hun eigen levensonderhoud, inclusief de taakverdeling waarmee dat bereikt wordt.","201"
"De arm van de overheid mag niet zover strekken dat de financiële druk op gezinnen met kinderen zo groot wordt, dat beide partners (bijna) fulltime moeten gaan werken om rond te kunnen komen.","603"
"De overheid moet óók de zegeningen tellen van de grote maatschappelijke verdiensten van mensen zonder betaalde arbeid, zoals vrijwilligerswerk, mantelzorg en de opvoeding van kinderen.","606"
"Concreet: In een gezin zijn man en vrouw samen verantwoordelijk voor elkaar en voor hun kinderen.","603"
"Hun eventueel gezamenlijke arbeidsparticipatie mag niet ten koste gaan van de zorg voor kinderen of mantelzorg.","603"
"De overheid houdt daar in haar beleid rekening mee.","603"
"De marktsector reageert sneller en heftiger op de nieuw ontstane economische situatie dan de collectieve sector.","408"
"Daardoor is het mogelijk de loonruimte van de collectieve sector te beperken.","414"
"Als gevolg daarvan is het ook eenvoudiger loonmatiging in de marktsector langer vol te houden.","414"
"Dit is cruciaal voor het behoud van banen en voor de concurrentiepositie van de Nederlandse economie.","414"
"Het ontslagstelsel wordt vereenvoudigd.","303"
"Er komt een wettelijke ontslagvergoeding, die rekening houdt met leeftijd en aantal dienstjaren en maatwerk voor de rechter mogelijk maakt.","303"
"Een preventieve ontslagtoets blijft bestaan.","701"
"De overheid moet er strikt op toezien dat werkgevers voldoende aandacht besteden aan het voorkómen van gezondheidsrisico’s.","504"
"In de komende jaren staat de overheid voor grote uitdagingen om mensen die nu aan de kant staan, toch -ondanks de economische crisis -arbeid te laten verrichten.","701"
"Daarom steekt de SGP extra geld in het vergroten van de kansen van oudere mensen op de arbeidsmarkt.","701"
"Als mensen nog kunnen werken, wil de SGP hen ondersteuning bieden bij het vinden van werk.","701"
"Als daarvoor eerst extra scholing nodig is, wil de SGP hen daarbij ondersteunen.","411"
"De steun is erop gericht om de eigen verantwoordelijkheid weer op te kunnen pakken.","201"
"Concreet: Iedere werkloze met een uitkering die kan werken, moet de kans krijgen een goede baan te vinden die past bij zijn ervaring of opleiding.","701"
"Als dit niet mogelijk is, moet er ruimte geboden worden om over te stappen naar een andere sector.","701"
"De uitvoerende instanties dragen er zorg voor dat kwetsbare jongeren meer dan evenredig aan bod komen bij het vervullen van openstaande vacatures.","705"
"Voor de economische ontwikkeling is het cruciaal dat iedereen die kan werken, dat ook doet.","505"
"Dit wordt gestimuleerd door het verschil tussen loon en uitkering te vergroten.","505"
"De maximale WW-duur wordt beperkt tot 2 jaar.","505"
"Er worden ook beperkingen gesteld aan het herhaald gebruik van de WW.","505"
"In het tweede jaar van de WW wordt de uitkering geleidelijk verlaagd.","505"
"Er moet een terughoudender opstelling komen ten opzichte van het algemeen verbindend verklaren van CAO’s.","505"
"Nu wordt er nog heel vaak in CAO’s gesuppleerd tot 100 procent bij ziekte, waardoor er weinig financiële prikkels voor werknemers overblijven om weer te re-integreren.","505"
"Daarnaast moet er een versoepeling van het dispensatiebeleid komen bij Algemeen verbindend verklaren, zodat bedrijven (weer) sneller een eigen ondernemings-CAO kunnen sluiten met vakbonden.","401"
"Sommige mensen hebben net een extra duwtje in de rug nodig om te kunnen functioneren op de arbeidsmarkt.","503"
"Als het aan de SGP ligt, krijgen zij dat duwtje.","503"
"Met name voor de toch al kwetsbare groepen op de arbeidsmarkt, zoals (gedeeltelijk) arbeidsgehandicapten, laagopgeleide jongeren en ouderen, is er nog veel werk aan de winkel.","503"
"Ook zij moeten kansen krijgen om volwaardig mee te (blijven) doen.","503"
"Concreet: Werkgevers die een Wajonger in dienst nemen, krijgen loonkostensubsidie.","503"
"Voordelen van deze wijziging zijn dat de Wajonger pensioen kan opbouwen,","705"
"dat hij één loonstrook krijgt (van zijn werkgever)","303"
"en dat ingewikkelde loon-en uitkeringsberekeningen niet meer nodig zijn.","303"
"Gemeenten worden verantwoordelijk voor Wajongers die gedeeltelijk arbeidsongeschikt zijn.","301"
"Beschut werk blijft bestaan.","705"
"Voor de nieuwe instroom betreft beschut werk niet een arbeidscontract, maar een voorziening die door de gemeente wordt aangeboden.","301"
"Ook voor mensen met een WIA-of WAO-uitkering die daarnaast beschikken over een WSW-indicatie, wordt het instrument van loonkostensubsidies ingezet om de instroom naar regulier werk te bevorderen.","705"
"Onderzocht moet worden of deze maatregel ook effectief is voor langdurig werklozen.","701"
"Te vaak gebeurt het dat mensen die onmiskenbaar begeleiding op het werk nodig hebben, geen jobcoaching krijgen toegekend.","705"
"Daarom worden de beleidsregels voor het toekennen van budgetten voor jobcoaching versoepeld.","705"
"Vooral in sectoren waar de uitstroom van ouderen tot grote tekorten van vakkrachten gaat leiden, worden oudere vakmensen ingezet om leerlingen te begeleiden.","701"
"Zo ontstaan waardevolle leermeester/gezelrelaties, zodat vakkennis behouden blijft en wordt overgedragen.","411"
"Leer-werktrajecten kunnen jongeren een goede dienst bewijzen.","506"
"Kleinschalige leerwerkcentra waar kwetsbare jongeren met een grote afstand tot de arbeidsmarkt worden opgeleid en begeleid richting een duurzaam betaalde baan, worden aangemoedigd.","705"
"De regels voor een uitkeringsgerechtigde om als kleine zelfstandige te beginnen, moeten nog verder worden versoepeld.","402"
"Daarnaast moet goede begeleiding worden geboden vanuit het UWV of re-integratiebureaus.","701"
"De financiële prikkels om de re-integratiegelden zo resultaatgericht mogelijk in te zetten, worden aangescherpt.","303"
"De verantwoording over de re-integratiebudgetten wordt ook voor overheidsorganisaties persoonsgebonden, zodat inzichtelijk wordt tot welke resultaten de inspanningen hebben geleid.","303"
"Soms moeten werkgevers over de streep getrokken worden om mensen met een zwakke arbeidsmarktpositie in dienst te nemen.","705"
"Dat kan het geval zijn als werknemers om wat voor reden dan ook minder kunnen presteren dan anderen","705"
"of omdat de overheid de arbeidsparticipatie van sommige groepen op de arbeidsmarkt wil bevorderen.","705"
"Concreet: Werkgevers die iemand met een kwetsbare arbeidsmarktpositie in dienst nemen, hebben meestal recht op premiekortingen.","705"
"Vaak kunnen kleine werkgevers die premiekortingen niet helemaal verzilveren.","705"
"Omdat juist bij kleine bedrijven veel kansen liggen, worden de premiekortingen vervangen door een bonusstelsel.","705"
"Werkgevers die iemand met een kwetsbare arbeidspositie in dienst nemen, krijgen een bonus die wordt uitgesmeerd over meerdere termijnen.","705"
"Daarbij wordt de bonus hoger naarmate de werknemer langer in dienst is.","705"
"Dat biedt een stimulans voor bedrijven om mensen duurzaam aan het werk houden.","705"
"De mogelijkheden om mensen met een kwetsbare arbeidsmarktpositie een proefplaatsing aan te bieden, worden verruimd.","705"
"Lastige en onoverzichtelijke regelingen schrikken werkgevers af om uitkeringsgerechtigden in dienst te nemen.","401"
"Daarom worden de administratieve lasten voor werkgevers die kwetsbare jongeren in dienst nemen, beperkt tot het minimum.","401"
"Werkgevers worden bovendien zoveel mogelijk persoonlijk benaderd om helderheid te verschaffen over de regelgeving.","401"
"Hoewel werken belangrijk is, staat de SGP ook pal voor mensen die om wat voor reden dan ook niet kunnen werken.","503"
"Vanuit Bijbelse naastenliefde dient de overheid een schild voor hen te zijn.","603"
"Als werken echt niet meer gaat, willen we -aanvullend op de ondersteuning vanuit familie, kerk en maatschappelijke verbanden -zorg dragen voor een goed sociaal vangnet voor hen die desondanks toch uit de boot dreigen te vallen.","503"
"De SGP wil dit principe ook in economisch mindere tijden te handhaven.","503"
"Concreet: Schuldhulpverlening is een taak die gemeenten goed moeten behartigen wanneer burgers vanwege problemen of onvoorziene omstandigheden niet meer aan hun financiële verplichtingen kunnen voldoen.","503"
"Voorkomen is echter beter dan genezen.","705"
"Daarom ligt hier ook in preventieve zin een belangrijk aandachtsgebied.","705"
"Het niet-gebruik van tegemoetkomingen wordt teruggedrongen.","705"
