"text","cmp_code","eu_code"
"Over nieuwbouw, onderhoud van bestaande woningen en de leefbaarheid van de buurt.","408",NA
"In grote woningcomplexen komt waar nodig een conciërge.","408",NA
"Zolang er leegstand is wordt het kraakverbod teruggedraaid.","503",NA
"Daar waar woningnood is moeten gemeenten leegstand bestrijden.","503",NA
"De overheid stimuleert duurzaam en energiezuinig bouwen.","416",NA
"Bouwvergunningen voor bestaande gebouwen worden alleen afgegeven als het gebouw daarna minimaal voldoet aan energielabel D.","416",NA
"Woningcorporaties gaan verplicht meer werk maken van de warmte-isolatie van bestaande woningen.","416",NA
"Wij maken een begin met een omvangrijke bouw van sociale huurwoningen om het woningtekort in Nederland tegen te gaan.","504",NA
"Gemeenten worden verantwoordelijk voor een sluitend vangnet van opvangvoorzieningen voor dak- en thuislozen, voor begeleide woonplekken en werkprojecten.","301",NA
"Ontslag uit een psychiatrische of justitiële inrichting wordt gekoppeld aan opvang en begeleiding.","503",NA
"Wijken worden gemengd, jong en oud, allochtoon en autochtoon, rijk en arm.",NA,NA
"Door een huisvestingswet krijgen gemeenten meer mogelijkheden om wijken te mengen.","301",NA
"De rijksoverheid neemt de verantwoordelijkheid voor een duurzame ruimtelijke inrichting van ons land.","416",NA
"Alleen zo krijgen we een goede spreiding van wonen en natuur, economie en recreatie.","416",NA
"Voor de leefbaarheid moet het mogelijkheid blijven om woningen te bouwen in de kleinere kernen.","408",NA
"Er komt een aanpak voor krimpregio’s en kleine kernen.","408",NA
"Ook in delen van Nederland waar de bevolking krimpt, moet de leefbaarheid worden gegarandeerd.","408",NA
"Voorzieningen moeten zo dicht mogelijk in de buurt blijven, van basisschool tot gemeenteloket, van thuiszorg tot winkelfiliaal, brievenbus, pinautomaat en bibliobus.","408",NA
"Van winkelbedrijven en banken die veel geld verdienen in dichtbevolkte gebieden, vragen we om ook op het dunner bevolkte platteland redelijke voorzieningen aan te bieden.","408",NA
"In gebieden waar bovenmatige krimp optreedt, springt de rijksoverheid bij om de noodzakelijke herstructurering mogelijk te maken.","408",NA
"In plaats van nieuwe kantoorruimte te bouwen kunnen we beter eerste ruim 8 miljoen m2 aan leegstaande kantoorruimte vullen.","408",NA
"Verouderde bedrijventerreinen kunnen we met een opknapbeurt weer aantrekkelijk maken voor ondernemers.","408",NA
"Het bestaande groen wordt toegankelijker gemaakt.","501",NA
"Historische stadsparken krijgen de status van beschermd stadsbeeld.","501",NA
"Woningbouw vindt vooral plaats in en rond stedelijke kernen, waartussen voldoende groene, open ruimte blijft.","501",NA
"De Ecologische Hoofdstructuur (EHS) wordt daadwerkelijk gerealiseerd.","501",NA
"We voorkomen grondspeculatie.","408",NA
"De meerwaarde die de grond oplevert als gevolg van de verandering van bestemming komt ten goede aan de gemeenschap.","503",NA
"Weinig onderwerpen in Nederland worden meer besproken dan de files.","411",NA
"Die lossen we niet op door alleen maar meer asfalt aan te leggen.","305",NA
"Ook helpt het niet om mensen in de file meer te laten betalen.","305",NA
"We stoppen dan ook met de filebelasting.","305",NA
"En nemen slimme maatregelen om in drukke tijden en op drukke plaatsen de doorstroming te bevorderen.","411",NA
"De eindeloze groei van luchthaven Schiphol leggen we aan banden.","416",NA
"Goederenvervoer via de binnenvaart gaan we stimuleren.","411",NA
"De politiek heeft steeds minder te zeggen over het openbaar vervoer.","413",NA
"De vervoersbedrijven zijn verzelfstandigd, of verkocht aan buitenlandse ondernemingen.","413",NA
"We geven de overheid meer verantwoordelijkheid voor het organiseren van de bus, de trein, de tram en de metro.","413",NA
"Bijvoorbeeld door zelf een vervoersbedrijf op te richten.","413",NA
"We investeren in een fijn vertakt netwerk van fatsoenlijk openbaar vervoer.","411",NA
"Ook nemen we maatregelen tegen overlast en agressie in het openbaar vervoer.","605",NA
"Een gemakkelijke oplossing voor de files bestaat niet.","305",NA
"Slimme oplossingen om de files te verminderen zijn er wel.","411",NA
"In het rapport Van stilstand naar vooruitgang noemen we maatregelen om de doorstroming in het verkeer te verbeteren.","305",NA
"Met wegmarkeringen,  verkeerslichten en navigatiesystemen kan het verkeer beter worden gedoseerd.","411",NA
"Sneller bergen bij ongelukken voorkomt ook veel fileleed.","411",NA
"Beter openbaar vervoer op industrieterreinen en kantoorgebieden helpt ook om files te bestrijden.","411",NA
"De overheid kan een bijdrage leveren door de werktijden beter te spreiden.","411",NA
"Zolang de kilometerheffing niet meer is dan een filebelasting, gaan we er niet aan beginnen.","411",NA
"Flessenhalzen in snelwegen lossen we op, zodat we de doorstroming bevorderen.","411",NA
"Met meer asfalt alleen lossen we de files echter niet op.","411",NA
"We nemen slimme maatregelen om de doorstroming in het verkeer te verbeteren, met wegmarkeringen, verkeerslichten en navigatiesystemen.","411",NA
"Minder files krijg je door beter openbaar vervoer.","411",NA
"Daarom breiden we het netwerk flink uit en eisen we van vervoersbedrijven op die lijnen gegarandeerde frequenties.","411",NA
"Gehandicapten mogen voortaan gratis parkeren.","705",NA
"Er komen meer en ruimere gereserveerde parkeerplaatsen voor gehandicapten.","705",NA
"De verplichte aanbesteding van bus- en treinvervoer wordt afgeschaft.","413",NA
"De overheid kan weer zijn eigen vervoersbedrijven beginnen.","413",NA
"In meerdere plaatsen in Nederland moet geëxperimenteerd worden met gratis openbaar vervoer.","411",NA
"Gemeenten en provincies krijgen steun bij initiatieven voor verbetering van het openbaar vervoer, zoals aanleg en uitbreiding van tramnetten en stappen naar gratis openbaar vervoer.","411",NA
"Met hoogwaardig openbaar vervoer op maat maken we woon-werkverkeer meer milieuvriendelijk.","411",NA
"Thuiswerken en gespreide werktijden gaan we stimuleren.","408",NA
"We leggen nieuwe spoorlijnen, inhaalsporen en stations aan, zoals langs de A27 tussen Utrecht en Breda.","411",NA
"Om het gebruik van de trein te stimuleren wordt het treinkaartje na de ochtendspits 50 procent goedkoper.","411",NA
"Het nachtnet dat op voorstel van de SP in Noord-Brabant in gebruik is genomen wordt uitgebreid tot een nationaal nachtnet.","411",NA
"Gegevens over het reisgedrag van reiziger mogen niet langer worden opgeslagen dan noodzakelijk is voor het vervoer.","201",NA
"Deze gegevens mogen niet worden gebruikt voor marketing-doeleinden.","201",NA
"De ov-chipkaart mag pas verplicht worden als de problemen met de kosten en het gebruik zijn opgelost.","408",NA
"Invoering mag ook niet leiden tot duurder openbaar vervoer.","503",NA
"Vervoersmaatschappijen gaan zorgen voor goede en gratis reisinformatie.","411",NA
"De NS worden samengevoegd met ProRail.","413",NA
"Zij worden een volledig overheidsbedrijf, onder verantwoordelijkheid van de betreffende minister.","413",NA
"Dit nieuwe bedrijf moet de dienstverlening op een hoger niveau brengen.","411",NA
"Voor mensen met een handicap maken we het openbaar vervoer beter toegankelijk.","705",NA
"Het (bovenregionaal) gehandicapten, ouderen- en leerlingenvervoer worden verbeterd, bijvoorbeeld door het in gemeentelijk beheer te nemen of bij aanbesteding kwaliteitseisen te stellen.","411",NA
"We willen weer betrouwbaar taxivervoer.","411",NA
"Gemeenten krijgen meer zeggenschap over de taxi.","411",NA
"De taximarkt gaan we reguleren, door een capaciteitsbeleid en door eisen te stellen aan de kwaliteit van de chauffeurs.","403",NA
"Luchthaven Schiphol kan niet eindeloos blijven groeien.","501",NA
"De overlast moet minder.","501",NA
"Daarom zijn Europese afspraken nodig over beperking en verdeling van het vliegverkeer.","108",NA
"De aandelen van Schiphol blijven in handen van de overheid.","413",NA
"Vliegveld Twente moet dicht blijven.","501",NA
"Luchthaven Lelystad en Eindhoven Airport mogen geen nieuwe groeilocatie worden voor Schiphol en slechts groeien tot de grenzen zoals vastgelegd in de Planologische Kern Beslissing van 2004.","501",NA
"Verplaatsing van Luchthaven Lelystad naar een andere locatie in Flevoland is geen optie.","501",NA
"Ook voor andere luchthavens stellen we grenzen aan de groei.","501",NA
"De overlast van militaire Awacs-vliegtuigen wordt aangepakt.","501",NA
"Binnenvaart en kustvaart gaan we beter inzetten voor het goederenvervoer, ter ontlasting van het spoor- en wegennet.","411",NA
"Het gebruik van de fiets gaan we volop stimuleren.","411",NA
"Er komen meer bewaakte gratis fietsenstallingen bij (bus)stations.","411",NA
"Beschermen wat kwetsbaar is, dat is een kwestie van beschaving.","503",NA
"Bijna 380.000 kinderen groeien op in armoede.","503",NA
"Elk jaar vallen bijna 50. 000 jongeren uit in het onderwijs.","503",NA
"Wij hebben de taak onze kinderen een eerlijke kans te geven op een goede toekomst.","503",NA
"Daarom helpen we gezinnen met een lager inkomen.","504",NA
"En zorgen we voor hulp bij opvoeding.","504",NA
"We nemen maatregelen om kindermishandeling te voorkomen","503",NA
"en de jeugdzorg op orde te brengen.","504",NA
"Mensen met een lichamelijke, verstandelijke of psychische beperking moeten volwaardig kunnen deelnemen aan de samenleving.","503",NA
"Met een beetje steun maken we het leven voor mensen met een handicap een stuk gemakkelijker.","503",NA
"We nemen maatregelen om het vervoer voor gehandicapten te verbeteren,","503",NA
"de toegankelijkheid van gebouwen te vergroten","503",NA
"en meer onderwijs op maat te bieden.","506",NA
"Ook verbeteren we de toegankelijkheid van overheidswebsites.","303",NA
"Bijna nergens is het falen van de politiek zo duidelijk als in de jeugdzorg.","305",NA
"Miljarden worden uitgegeven aan managers, bureaucratie en instanties die langs elkaar heen werken.","303",NA
"Met als gevolg ontwrichte gezinnen, ouders en kinderen zonder toekomst.","305",NA
"In het rapport De jeugdhulpverlener aan het woord blijkt dat de werkdruk veel te hoog is; medewerkers verdrinken in het papierwerk en hulpverleners hebben veel te weinig tijd voor de kinderen.","303",NA
"Jeugdhulpverleners willen meer zeggenschap over hun eigen werk en minder controle van bovenaf.","704",NA
"Ook willen zij geen marktwerking in de jeugdzorg.","704",NA
"De kinderbijslag wordt inkomensafhankelijk en vervalt voor gezinnen met de hoogste inkomens.","503",NA
"Kinderopvang dient betaalbaar te zijn en van goede kwaliteit.","504",NA
"Ook voor kinderen met een specifieke sociale of medische indicatie moet goede opvang worden gegarandeerd.","503",NA
"Ouders gaan voor het tweede en de volgende kind(eren) zelf naar draagkracht meer bijdragen aan de kinderopvang.","503",NA
"Vanuit laagdrempelige centra in de buurt worden ouders ondersteund bij de opvoeding, wordt hulp en zorg geboden en als dat nodig is rechtstreeks doorverwezen naar specialistische hulp.","504",NA
"Er komt een permanente campagne tegen kindermishandeling.","503",NA
"Er komen meer behandelplaatsen voor kinderen die het slachtoffer zijn van kindermishandeling.","503",NA
"Overgewicht bij kinderen gaan we terugdringen.","504",NA
"Reclame voor ongezonde voeding gericht op kinderen tot twaalf jaar wordt verboden.","504",NA
"Snoep- en frisdrankautomaten weren we uit scholen.","504",NA
"Voorlichting aan ouders verbeteren we.","504",NA
"Jeugdwerkloosheid gaan we aanpakken, met bindende afspraken tussen overheid, werkgevers, werknemers en onderwijsinstellingen, over opleidingen, banen, stages en leerwerkplaatsen.","701",NA
"Voor jongeren zonder startkwalificatie komen volop mogelijkheden om een opleiding te volgen.","706",NA
"De werkloosheid onder kinderen van migranten vraagt extra aandacht.","705",NA
"Uitval in het vmbo en het beroepsonderwijs wordt bestreden door intensievere begeleiding.","506",NA
"Leerlingen die dat nodig hebben krijgen praktijkgerichte lessen.","506",NA
"Discriminatie op de arbeidsmarkt accepteren we niet.","503",NA
"Iedereen onder de 23 jaar leert of werkt.","506",NA
"Zonder startkwalificatie hoort niemand het onderwijs te verlaten.","506",NA
"Uitval in het voortgezet en het beroepsonderwijs pakken we aan door intensievere begeleiding.","506",NA
"Jongeren onder de 27 jaar krijgen weer recht op bijstand.","504",NA
"Er komen meer plekken in de jeugdzorg, zodat jongeren niet meer hoeven te wachten op de noodzakelijke hulp.","504",NA
"Het opsluiten van jongeren in de jeugdzorg gaan we voorkomen.","706",NA
"We willen meer gezinshuizen en pleeggezinnen en meer plekken voor opvang van zwerfjongeren.","504",NA
"We investeren meer in preventie, zodat we problemen kunnen voorkomen.","504",NA
"Jeugdzorg gaat waar mogelijk naar de gemeenten.","301",NA
"De marktwerking in geestelijke gezondheidszorg voor jongeren wordt teruggedraaid.","413",NA
"Jeugdhulpverleners krijgen meer tijd voor contact met kinderen en gezinnen.","704",NA
"Er komen meer jongerenwerkers en meer voorzieningen voor jongeren in de buurt, zoals buurtcentra en skatebanen.","504",NA
"We willen geen ‘mosquito’s’ (piepkastjes) die jongeren wegjagen.","706",NA
"Veel adoptieouders zetten zich met hart en ziel in voor hun kinderen.","706",NA
"Over het algemeen is het echter beter voor kinderen als ze in hun oorspronkelijke omgeving kunnen opgroeien.","706",NA
"Adoptie van buitenlandse kinderen moet daarom niet onbeperkt zijn.","706",NA
"De overheid controleert nauwgezet of er sprake is van kinderontvoering, kinderhandel of corruptie.","605",NA
"Gehandicapten mogen voortaan gratis parkeren.","705",NA
"Het gehandicaptenvervoer wordt verbeterd, door het in gemeentelijk beheer te nemen of bij aanbesteding kwaliteitseisen te stellen.","705",NA
"En bij vertraging krijgen mensen geld terug.","705",NA
"Voor mensen met een handicap maken we treinen en perrons, maar ook bussen, trams en metro’s beter toegankelijk.","705",NA
"Ook de toegankelijkheid van de openbare ruimte en van gebouwen wordt verbeterd voor mensen met een beperking.","705",NA
"De zakgeld- en kleedgeldregeling wordt verruimd.","705",NA
"De overheid en grote bedrijven moeten meer mensen met een handicap of gedeeltelijke arbeidsongeschiktheid in dienst nemen en passende stageplekken organiseren.","705",NA
"Daarvoor maken we een wettelijke regeling.","705",NA
"Overheidswebsites en diensten maken we beter toegankelijk voor mensen met een beperking.","705",NA
"Nederland moet het verdrag inzake de rechten van personen met een handicap van de VN met spoed ondertekenen.","201",NA
"We hebben niet alleen een economische crisis het hoofd te bieden.","501",NA
"Op termijn dreigt ook een klimaatcrisis.","501",NA
"Ons milieu wordt bedreigd en de zeespiegel zal stijgen, wat grote gevolgen kan hebben voor ons lage land.","501",NA
"Het toekomstige tekort aan fossiele brandstoffen kan leiden tot mondiale conflicten.","416",NA
"Reden genoeg om een stevig klimaatbeleid te voeren, met nadruk op energiebesparing en duurzame energie- en voedselproductie.","416",NA
"En op investeringen in een duurzame economie","416",NA
"en een groen belastingstelsel.","416",NA
"Het is een grote fout dat bestuurders onze grote energiebedrijven hebben verkocht aan buitenlandse ondernemingen.","413",NA
"Dat maakt het voeren van een duurzaam energiebeleid onnodig moeilijk.","413",NA
"De overheid neemt de komende jaren haar verantwoordelijkheid voor energiezuinig produceren en meer duurzame stroom- en gasproductie.","416",NA
"Landschap en natuur worden te gemakkelijk opgeofferd aan commerciële kortetermijnbelangen.","501",NA
"Boeren die ons landschap beheren, gaan ten onder in een moordende wereldconcurrentie.","703",NA
"Willen we een gezonde boerenstand zijn werk naar behoren laten doen, het dierenwelzijn bewaken, het landschap behouden, de natuur onderhouden en het milieu beschermen, dan dient de komende regering op dit gebied andere keuzes te maken.","305",NA
"Naast de bestaande klimaatdoelstellingen voor 2020, worden ook doelstellingen voor de langere termijn (2050) geformuleerd.","416",NA
"We gaan ontwikkelingslanden een stevige hand helpen met het opzetten van een goed klimaatbeleid.","107",NA
"De energiebelasting voor bedrijven wordt op termijn gelijkgesteld aan die voor consumenten.","503",NA
"De Gasunieconstructie - waarbij Shell en Esso 50 procent van de opbrengst van het gas krijgen - wordt ongedaan gemaakt.","503",NA
"Geld dat hierdoor vrijkomt wordt gestopt in een investeringsfonds voor duurzame energie.","416",NA
"We pakken onze energievoorziening terug.","413",NA
"Daarom stimuleren wij gemeenten die alleen of gezamenlijk een duurzaam gemeentelijk of regionaal energiebedrijf willen oprichten.","416",NA
"De uitstootrechten in de emissiehandel in CO2 gaan we stapsgewijs verlagen.","416",NA
"We stoppen met het gratis weggeven van emissierechten.","416",NA
"Voordat we overgaan tot ondergrondse opslag van CO2 moeten de effecten daarvan beter worden onderzocht.","416",NA
"In plaats van dure en onzekere investeringen te doen in het opslaan van CO2 kunnen we beter investeren om de uitstoot van CO2 terug te dringen.","416",NA
"We bevorderen energiezuiniger bouwen, transport en productie,","416",NA
"het nuttig gebruik van restwarmte van elektriciteitscentrales en industrie en andere energiebesparende technieken,","416",NA
"en de uitbreiding van duurzame stroom- en gasproductie.","416",NA
"Kolen-, olie- en kerncentrales moeten worden vervangen door zonne-, wind- en andere duurzame energie.","416",NA
"Er komt een ruimere subsidie voor zonnepanelen.","416",NA
"In een Klimaatwet nemen we maatregelen voor een duurzame energievoorziening.","416",NA
"De subsidie voor duurzame energie wordt beperkt tot technieken die nog volop in ontwikkeling zijn, zoals zonnestroom.","416",NA
"Voor wind, biomassa en andere technieken die al bijna volwassen zijn, komt er een verplicht aandeel duurzame productie voor de energieleveranciers.","416",NA
"De overheid geeft zelf het goede voorbeeld op het gebied van energiebesparing, zuinige auto’s en het gebruik van duurzame energie en bouwmaterialen.","416",NA
"Er komt een heffing op het landen en opstijgen van vliegtuigen om de schadelijke milieugevolgen van het vliegverkeer terug te dringen, zolang er geen Europese kerosineheffing is.","416",NA
"We streven naar een zo sterk mogelijke vergroening van het belastingstelsel, waarbij milieuvriendelijk produceren wordt bevorderd en vervuilende productie zwaarder wordt belast.","416",NA
"We moeten zuinig zijn met het gebruik van grondstoffen.","416",NA
"Producenten worden verantwoordelijk gesteld voor de afvalproductie en de verpakkingsindustrie wordt aangepakt.","416",NA
"De illegale handel in afval via Nederland gaan we aanpakken door streng te handhaven in de havens en toe te zien op de afvalmakelaars.","605",NA
"In Europees verband stellen we voorwaarden voor een verantwoorde verwerking van ons afval.","108",NA
"De controle op en bestraffing van illegale lozingen op zee krijgt een hogere prioriteit.","605",NA
"Het transport van gevaarlijke stoffen dient tot een minimum te worden teruggebracht.","605",NA
"Gemeenten moeten op de hoogte zijn van het vervoer van gevaarlijke stoffen en rampenplannen opstellen.","605",NA
"Zij moeten de bevolking adequaat informeren.","605",NA
"Om bureaucratie te voorkomen komt er één landelijke inspectiedienst die toezicht houdt op milieu, arbeidsomstandigheden, volksgezondheid en ruimtelijke ordening.","403",NA
"De handhavers krijgen een ruim mandaat en doorzettingsmacht.","605",NA
"Er komen betere regels voor bescherming tegen bodemverontreiniging.","501",NA
"Er komt een nationaal plan om asbest te inventariseren en te verwijderen.","501",NA
"De intensieve veehouderij is in Nederland verantwoordelijk voor 14 procent van de uitstoot van broeikasgassen.","501",NA
"Alleen al daarom zal de veestapel verkleind moeten worden.","501",NA
"We stimuleren warmtekrachtkoppelingscentrales en CO2-gebruik bij tuinders.","416",NA
"Uitstoot gaan we ook tegen door het bevorderen van duurzame landbouw en kortere transportafstanden.","416",NA
"1/3 van de boerenbevolking leeft onder de armoedegrens.","703",NA
"Elke week verdwijnen tientallen boerenbedrijven.","703",NA
"Boeren horen een eerlijke prijs te krijgen voor een eerlijk product.","703",NA
"Verkoop onder de kostprijs wordt aangepakt.","703",NA
"Ruim 95 procent van de 450 miljoen landbouwdieren leeft in de bio-industrie.","416",NA
"De bio-industrie dringen we terug.","416",NA
"Nederland wordt een land met een diervriendelijke veehouderij.","416",NA
"Verdere schaalvergroting en megastallen gaan we tegen.","416",NA
"We bevorderen grondgebonden veehouderij.","501",NA
"Dierenwelzijnsnormen worden aangescherpt.","501",NA
"Verminking van dieren wordt verboden.","501",NA
"Het fokken en doden van dieren uitsluitend om hun bont of verenkleed wordt eveneens verboden.","501",NA
"Om dierenmishandeling tegen te gaan kan de rechter een verbod opleggen op het houden van dieren.","501",NA
"Transporten van slachtdieren over lange afstanden wordt verboden.","501",NA
"‘Plezierjacht’ wordt eveneens verboden.","501",NA
"Het preventieve gebruik van antibiotica in de intensieve veehouderij dient verboden te worden.","501",NA
"Het algemene gebruik moet tot het minimum worden beperkt.","501",NA
"In de Noordzee maken we beschermde natuurgebieden, om natuurherstel en herstel van de visstand te bevorderen.","501",NA
"Overbevissing gaan we voorkomen.","501",NA
"Het onderzoek naar vleesvervangende producten wordt bevorderd.","501",NA
"Biologische voeding wordt door de overheid gepromoot.","501",NA
"Het aantal dierproeven wordt tot een minimum beperkt.","501",NA
"Waar alternatieven voor dierproeven voorhanden zijn, worden deze verplicht gesteld.","501",NA
"Er komt een (grond)wettelijke zorgplicht voor het welzijn van dieren.","501",NA
"In een gezonde samenleving werken we om te leven – en niet andersom.","502",NA
"Na ons werk willen we op een prettige manier ontspannen.","502",NA
"En voldoende gelegenheid hebben om onze creativiteit te ontplooien.","502",NA
"Dat vereist voldoende betaalbare voorzieningen voor sport en amusement en mogelijkheden om bezig te zijn met kunst en cultuur.","502",NA
"En het vereist een rigoureus indammen van de almaar uitdijende recreatie- en cultuurmarkt, waarop alles van waarde een koopwaar wordt en de dikte van de portemonnee bepaalt wie zich wat kan permitteren.","403",NA
"In tijden van crisis is de cultuur vaak het eerste slachtoffer.","502",NA
"Maar juist in crisistijd kunnen kunst en cultuur een signaal zijn van nieuwe hoop en creativiteit.","502",NA
"Een creatieve samenleving daagt iedereen uit zichzelf te blijven ontwikkelen.","502",NA
"Dat kan in bibliotheken en musea, in muziekscholen en fanfares, in zangkoren en toneelclubs, op poppodia, in ateliers voor beeldende kunst en andere kleinschalige centra.","502",NA
"De media vormen een bron van vermaak, maar ook van informatie en confrontatie van opvattingen.","201",NA
"Voor een vrije en democratische samenleving is het van belang dat de media niet geheel afhankelijk worden van de commercie.","201",NA
"De overheid helpt daarom de vrije nieuwsgaring te beschermen.","201",NA
"Wie zijn geschiedenis niet kent, is slecht toegerust voor de toekomst.","601",NA
"Juist in een land waar de tweedeling groeit, is het van belang kennis te nemen van ons verleden.","601",NA
"Het door de SP gelanceerde idee voor de oprichting van een Nationaal Historisch Museum is inmiddels door het parlement en de regering omarmd.","601",NA
"Binnenkort kan daardoor iedereen die dat wil, daar het verhaal van onze gezamenlijke geschiedenis zien, beleven en overdenken.","601",NA
"De toegang tot rijksmusea wordt gratis.","502",NA
"Andere gesubsidieerde musea horen minstens één dag per week gratis toegankelijk te zijn.","502",NA
"Nederlandse muzikanten moeten een eerlijke kans krijgen om met muziek maken de kost te verdienen.","502",NA
"Concertbezoekers moeten wettelijk beschermd worden tegen het opdrijven van de prijzen van tickets voor concerten en evenementen.","502",NA
"De overheid moet in samenspraak met kunstenaars en artiesten maatregelen nemen voor subsidiëring en ondersteuning.","502",NA
"Beroepskunstenaars moeten een eerlijke kans krijgen om met hun eigen werk een fatsoenlijk inkomen te verdienen.","502",NA
"Bibliotheken zijn niet alleen kenniscentra, maar ook ontmoetingsplaatsen voor de inwoners van wijken en dorpen.","606",NA
"Ze verdienen daarom blijvende steun van de overheid.","502",NA
"Muziekscholen en fanfares, zangkoren en toneelclubs, poppodia, ateliers voor beeldende kunst en andere kleinschalige creatieve centra zijn de basis voor een breed cultureel leven.","502",NA
"De overheid erkent haar verantwoordelijkheid om dit culturele leven levendig te houden en waar nodig te ondersteunen.","502",NA
"Het maken van kunst en genieten van cultuur dicht bij huis – niet alleen in de stad, maar ook op het platteland – moet door de overheid worden aangemoedigd.","502",NA
"Tenminste 3 procent van de ruimte in een wijk moet worden bestemd voor sport- en speelruimte.","502",NA
"Jongeren hebben recht op eigen plekken in hun buurt.","502",NA
"Sportvelden in buurten en dorpen worden zoveel mogelijk behouden.","502",NA
"De compensatie van de ecotaks voor sportverenigingen blijft bestaan.","502",NA
"Investeringen van de overheid in de topsport horen in ieder geval gepaard te gaan met investeringen in de breedte- en amateursport.","502",NA
"Er komt een betere vervoersregeling voor gehandicapte sporters.","502",NA
"Naast sportrolstoelen komen ook andere hulpmiddelen voor gehandicapte sporters voor vergoeding in aanmerking.","502",NA
"De Nederlandse Publieke Omroep verdient bescherming én verdere ontwikkeling.","502",NA
"Voor omroepverenigingen wordt een promotie-degradatiesysteem ingevoerd op grond van bereik en waardering.","502",NA
"Het ledental bepaalt slechts een deel van de zendtijd.","502",NA
"Er komt een onafhankelijke kijkwijzer.","502",NA
